message_id	response_id	article_id	essay	gender	education	race	age	income	raw_input_emotions	empathy	distress	emotion
R_2OGyc9wmH81hg6X_3	R_2OGyc9wmH81hg6X	231	in this day and age, there should not be such a thing as airline discrimination. the only way someone should exist discontinue or removed from their flights be if they expose violent behavior or if they be try to board with weapons. it be not acceptable at all for someone to be barricade from their flight due to the color of their skin or their religious or ethnic background. those who make be discriminate against for these reasons be hurt undue embarrassment and inconvenience. they should be cover for this unfair treatment and the airlines should be fin heavily.	2.0	5.0	1.0	52.0	51000.0	[BOS] In this day and age, there should not be such a thing as airline discrimination. [BOE] [neutral] [EOE] [EOS] {sep_tok} [BOS] The only way someone should be stopped or removed from their flights is if they displayed violent behavior or if they were trying to board with weapons. [BOE] [neutral] [EOE] [EOS] {sep_tok} [BOS] It is not acceptable at all for someone to be barred from their flight due to the color of their skin or their religious or ethnic background. [BOE] [anger] [EOE] [EOS] {sep_tok} [BOS] Those who have been discriminated against for these reasons are suffering undue embarrassment and inconvenience. [BOE] [sadness] [EOE] [EOS] {sep_tok} [BOS] They should be compensated for this unfair treatment and the airlines should be fined heavily. [BOE] [neutral] [EOE] [EOS]	6.5	5.5	anger
R_2OGyc9wmH81hg6X_4	R_2OGyc9wmH81hg6X	270	the coal mines in china should be shut down until every last one of them be audit and deem safe for operation. 33 miners misplace their lives due to incompetence. those poor families who make to deal with mislay a loved one in such a horrible way. i can't guess what they must be feeling. this be such a tragedy.	2.0	5.0	1.0	52.0	51000.0	[BOS] The coal mines in China should be shut down until every last one of them is inspected and deemed safe for operation. [BOE] [neutral] [EOE] [EOS] {sep_tok} [BOS] 33 miners lost their lives due to incompetence. [BOE] [sadness] [EOE] [EOS] {sep_tok} [BOS] Those poor families who have to deal with losing a loved one in such a horrible way. [BOE] [sadness] [EOE] [EOS] {sep_tok} [BOS] I can't imagine what they must be feeling. [BOE] [surprise] [EOE] [EOS] {sep_tok} [BOS] This is such a tragedy. [BOE] [sadness] [EOE] [EOS]	5.0	7.0	sadness
R_2OGyc9wmH81hg6X_5	R_2OGyc9wmH81hg6X	341	word must start out about the terrible conditions the forgotten victims of the west's drought be suffering through. our government need to build a stronger effort to these people in nevado. there needs to be more publicity so more people can reach out to help. not only make the drought have economic issues, but also psychological as well. there be an increase in domestic violence and substance abuse as well as child neglect. help be want drastically in so many ways. we can't let the native americans or anyone in this area hurt like they be and just tolerate by and watch.	2.0	5.0	1.0	52.0	51000.0	[BOS] Word must get out about the terrible conditions the Forgotten Victims of the West's Drought are suffering through. [BOE] [fear] [EOE] [EOS] {sep_tok} [BOS] Our Government need to make a stronger effort to these people in Nevado. [BOE] [neutral] [EOE] [EOS] {sep_tok} [BOS] There needs to be more publicity so more people can reach out to help. [BOE] [neutral] [EOE] [EOS] {sep_tok} [BOS] Not only has the drought caused economic issues, but also psychological as well. [BOE] [neutral] [EOE] [EOS] {sep_tok} [BOS] There is an increase in domestic violence and substance abuse as well as child neglect. [BOE] [neutral] [EOE] [EOS] {sep_tok} [BOS] Help is needed drastically in so many ways. [BOE] [neutral] [EOE] [EOS] {sep_tok} [BOS] We can't let the native americans or anyone in this area suffer like they are and just stand by and watch. [BOE] [neutral] [EOE] [EOS]	7.0	5.625	anger
R_3HXpYAQurUwDq6t_1	R_3HXpYAQurUwDq6t	57	i make never really cogitate about what happen to animals during war or conflicts in general. i imply i be just register this article about the efforts of veterinarians in the middle east and africa gaza in particular. try to write animals that be malnourish because of lack of treatment thanks to the conflict. the entirety of the strip only make 12 veternarians tend to it sadly and even though the government seem to want to avail it serve not seem possible.	1.0	4.0	2.0	23.0	70000.0	[BOS] I have never really thought about what happens to animals during war or conflicts in general. [BOE] [neutral] [EOE] [EOS] {sep_tok} [BOS] I mean i was just reading this article about  the efforts of veterinarians in the middle east and africa Gaza in particular. [BOE] [neutral] [EOE] [EOS] {sep_tok} [BOS] Trying to save animals that are malnourished because of lack of treatment thanks to the conflict. [BOE] [joy] [EOE] [EOS] {sep_tok} [BOS] The entirety of the strip only has 12 veternarians tending to it sadly and even though the government seems to want to help it does not seem possible. [BOE] [sadness] [EOE] [EOS]	4.0	3.875	sadness
R_3HXpYAQurUwDq6t_2	R_3HXpYAQurUwDq6t	137	it is really a shame the way that countries experience be cover their migrants and people who make proceed their as refugees. in france in particular the shutdown of the migrant camps be a key part of the election be what frustrate me. that people could be so against avail others by tolerate them residency and migrant just seem wrong and so calloused.	1.0	4.0	2.0	23.0	70000.0	[BOS] It is really a shame the way that countries have been treating their migrants and people who have moved their as refugees. [BOE] [sadness] [EOE] [EOS] {sep_tok} [BOS] In France in particular the shutdown of the migrant camps being a key part of the election is what baffles me. [BOE] [surprise] [EOE] [EOS] {sep_tok} [BOS] That people could be so against helping others by allowing them residency and migrant just seems wrong and so calloused. [BOE] [anger] [EOE] [EOS]	2.0	3.75	disgust
R_3HXpYAQurUwDq6t_3	R_3HXpYAQurUwDq6t	229	the situation within india seem like such big proof that things cannot start better without first start worse in a way. the new movements to abolish black money be reall have chaos over there. just aboloshing three types of currency make wound them so much. could you guess if one day the 10 and 20 dollar bills be no longer acceptable would be complete chaos.	1.0	4.0	2.0	23.0	70000.0	[BOS] The situation within India seems like such big proof that things cannot get better without first getting worse in a way. [BOE] [sadness] [EOE] [EOS] {sep_tok} [BOS] The new movements to abolish black money is reall causing chaos over there. [BOE] [neutral] [EOE] [EOS] {sep_tok} [BOS] Just aboloshing three types of currency has hurt them so much. [BOE] [sadness] [EOE] [EOS] {sep_tok} [BOS] Could you imagine if one day the 10 and 20 dollar bills were no longer acceptable would be complete chaos. [BOE] [surprise] [EOE] [EOS]	2.667	3.25	fear
R_3HXpYAQurUwDq6t_4	R_3HXpYAQurUwDq6t	333	storm season every year mark me because every part of the world be in danger in some way. in taiwan in particular they have be wrack many times by typhoons and hurricanes and meranty looks to coiffe the same. be classify as a category 5 it be the strongest to shoot the area in years and it really build me interest for taiwan as they poise for its landfall.	1.0	4.0	2.0	23.0	70000.0	[BOS] Storm season every year scares me because every part of the world is in danger in some way. [BOE] [fear] [EOE] [EOS] {sep_tok} [BOS] In taiwan in particular they have been wracked many times by typhoons and hurricanes and Meranty looks to do the same. [BOE] [neutral] [EOE] [EOS] {sep_tok} [BOS] Being classified as a category 5 it is the strongest to hit the area in years and it really makes me worry for Taiwan as they brace for its landfall. [BOE] [fear] [EOE] [EOS]	1.0	4.0	fear
R_3HXpYAQurUwDq6t_5	R_3HXpYAQurUwDq6t	339	the way that the united kingdom be cover its refugees within the camps be nothing short of barbaric. it is actually so sad insure these people who operate from war get to countries just to be unwanted and amass up into camps. the children within the calais camp in particular be just be drop and blackguard and exist lack so many things command for growth	1.0	4.0	2.0	23.0	70000.0	[BOS] The way that the United Kingdom is treating its refugees within the camps is nothing short of barbaric. [BOE] [disgust] [EOE] [EOS] {sep_tok} [BOS] It is actually so sad seeing these people who ran from war get to countries just to be unwanted and hoarded up into camps. [BOE] [sadness] [EOE] [EOS] {sep_tok} [BOS] The children within the Calais camp in particular are just being neglected and abused and are lacking so many things required for growth [BOE] [sadness] [EOE] [EOS]	2.5	1.875	sadness
R_305J9l0iUGQktaw_1	R_305J9l0iUGQktaw	11	coiffe you insure the latest on the death toll? some be civilians admit two women who be in their house. can you guess how scared they were? i always cogitate of their families or friends or partners. those women be someone's person. people make their person pack away for no reason. i can't guess how heartbreaking that must feel. if i lost my husband like that i don't bed how i would even operate on. especially exist civilians like that and exit in their home. they probably cogitate they exist safe. i inquire what they recollect in the last moments. did they bed they be in danger, could they discover signs? coiffe they bed for sure they be operate to exit or coiffe they make hope that they might urinate it? coiffe they shelter together and console each other and try to be brave? i feel sick thinking aobut	2.0	6.0	1.0	40.0	80000.0	[BOS] Did you see the latest on the death toll? [BOE] [surprise] [EOE] [EOS] {sep_tok} [BOS] Some were civilians including two women who were in their house. [BOE] [neutral] [EOE] [EOS] {sep_tok} [BOS] Can you imagine how scared they were? [BOE] [surprise] [EOE] [EOS] {sep_tok} [BOS] I always think of their families or friends or partners. [BOE] [neutral] [EOE] [EOS] {sep_tok} [BOS] Those women were someone's person. [BOE] [neutral] [EOE] [EOS] {sep_tok} [BOS] People had their person taken away for no reason. [BOE] [neutral] [EOE] [EOS] {sep_tok} [BOS] I can't imagine how heartbreaking that must feel. [BOE] [sadness] [EOE] [EOS] {sep_tok} [BOS] If I lost my husband like that I don't know how I would even go on. [BOE] [surprise] [EOE] [EOS] {sep_tok} [BOS] Especially being civilians like that and dying in their home. [BOE] [neutral] [EOE] [EOS] {sep_tok} [BOS] They probably thought they were safe. [BOE] [neutral] [EOE] [EOS] {sep_tok} [BOS] I wonder what they thought in the last moments. [BOE] [surprise] [EOE] [EOS] {sep_tok} [BOS] Did they know they were in danger, could they hear signs? [BOE] [surprise] [EOE] [EOS] {sep_tok} [BOS] Did they know for sure they were going to die or did they have hope that they might make it? [BOE] [surprise] [EOE] [EOS] {sep_tok} [BOS] Did they shelter together and comfort each other and try to be brave? [BOE] [surprise] [EOE] [EOS] {sep_tok} [BOS] I feel sick thinking aobut [BOE] [sadness] [EOE] [EOS]	4.5	6.0	sadness
R_305J9l0iUGQktaw_2	R_305J9l0iUGQktaw	129	"i need to pronounce i'm surprised but i'm not. cain be just going through the same thing leslie jones and tons of other women fit through on twitter. everyone detest on women start imply in anything men ""own"" like comic books and ghostbusters. its ridiculous. she be direct by all the incels online and they're the angriest vilest group to plow with. i hope she just write a different series and maintain going. she doesn't want a twitter account. she can make more material with strong feminist characters and themes. marvel isn't really afraid of those topics and they coiffe direct a lot of ""edgier"" themes and they have female representation. so hopefully she restrain write and i can't wait until the day those attitudes against women be considered weird and in the minority. wait until everyone lo"	2.0	6.0	1.0	40.0	80000.0	"[BOS] I want to say I'm surprised but I'm not. [BOE] [surprise] [EOE] [EOS] {sep_tok} [BOS] Cain is just going through the same thing Leslie Jones and tons of other women go through on twitter. [BOE] [neutral] [EOE] [EOS] {sep_tok} [BOS] Everyone hates on women getting involved in anything men ""own"" like comic books and Ghostbusters. [BOE] [neutral] [EOE] [EOS] {sep_tok} [BOS] Its ridiculous. [BOE] [anger] [EOE] [EOS] {sep_tok} [BOS] She was targeted by all the incels online and they're the angriest vilest group to deal with. [BOE] [anger] [EOE] [EOS] {sep_tok} [BOS] I hope she just writes a different series and keeps going. [BOE] [joy] [EOE] [EOS] {sep_tok} [BOS] She doesn't need a twitter account. [BOE] [neutral] [EOE] [EOS] {sep_tok} [BOS] She can create more material with strong feminist characters and themes. [BOE] [neutral] [EOE] [EOS] {sep_tok} [BOS] Marvel isn't really afraid of those topics and they do address a lot of ""edgier"" themes and they have female representation. [BOE] [neutral] [EOE] [EOS] {sep_tok} [BOS] So hopefully she keeps writing and I can't wait until the day those attitudes against women are considered weird and in the minority. [BOE] [joy] [EOE] [EOS] {sep_tok} [BOS] Wait until everyone lo [BOE] [neutral] [EOE] [EOS]"	4.333	5.875	anger
R_305J9l0iUGQktaw_3	R_305J9l0iUGQktaw	203	i cannot believe what i just read. on one hand, i need to pronounce i cannot guess why anyone would coiffe that but in a way i almost can?? i can insure how you would be too scared to go to a doctor sometimes and cogitate you can cover things at home. but this be something serious!!! he be pall it be discontinue so i don't bed why he would couch a steel chopstick in there???? be it theorize to desexualise it? this guy must make be seriously pall to try to check things out at home. he must make be terrified. i feel so bad. he must have be so upset to substantiate he couldn't get it out, and bed now he make to operate to the doctor. thank god he didn't advertize it in any further or they said he could make died! poor guy. at least he discontinue before that point. he must be on his own because his wife would make nag	2.0	6.0	1.0	40.0	80000.0	[BOS] I cannot believe what I just read. [BOE] [surprise] [EOE] [EOS] {sep_tok} [BOS] On one hand, I want to say I cannot imagine why anyone would do that but in a way I almost can?? [BOE] [surprise] [EOE] [EOS] {sep_tok} [BOS] I can see how you would be too scared to go to a doctor sometimes and think you can handle things at home. [BOE] [fear] [EOE] [EOS] {sep_tok} [BOS] But this was something serious!!! [BOE] [fear] [EOE] [EOS] {sep_tok} [BOS] He was scared it was broken so I don't know why he would put a steel chopstick in there???? [BOE] [fear] [EOE] [EOS] {sep_tok} [BOS] Was it supposed to fix it? [BOE] [surprise] [EOE] [EOS] {sep_tok} [BOS] This guy must have been seriously scared to try to check things out at home. [BOE] [fear] [EOE] [EOS] {sep_tok} [BOS] He must have been terrified. [BOE] [fear] [EOE] [EOS] {sep_tok} [BOS] I feel so bad. [BOE] [sadness] [EOE] [EOS] {sep_tok} [BOS] He must have been so upset to realize he couldn't get it out, and knowing now he had to go to the doctor. [BOE] [surprise] [EOE] [EOS] {sep_tok} [BOS] Thank god he didn't push it in any further or they said he could have died! [BOE] [joy] [EOE] [EOS] {sep_tok} [BOS] Poor guy. [BOE] [sadness] [EOE] [EOS] {sep_tok} [BOS] At least he stopped before that point. [BOE] [neutral] [EOE] [EOS] {sep_tok} [BOS] He must be on his own because his wife would have nagged [BOE] [neutral] [EOE] [EOS]	3.5	3.25	fear
R_305J9l0iUGQktaw_4	R_305J9l0iUGQktaw	283	i really didn't substantiate how far the oppression of women in saudi arabia went. i bed some of the points but definitely didn't substantiate a woman always make a male guardian. i didn't substantiate if her husband died, her son could suit her guardian. where be the dignity in that? can you guess how bad it would feel to want permission to work, operate to school, pull an apartment, coiffe anything you want basically? and to want to start permission from your own child? imagine level a child, give him, chaging his diapers, teach him how to act... and then suddenly want that child's permission to coiffe anything or make to start his signature on anything. that's so demoralizing. women really be cover like property there. i hope they get the changes they merit but it's scary to cogitate of the power strug	2.0	6.0	1.0	40.0	80000.0	[BOS] I really didn't realize how far the oppression of women in Saudi Arabia went. [BOE] [surprise] [EOE] [EOS] {sep_tok} [BOS] I knew some of the points but definitely didn't realize a woman always had a male guardian. [BOE] [surprise] [EOE] [EOS] {sep_tok} [BOS] I didn't realize if her husband died, her son could become her guardian. [BOE] [surprise] [EOE] [EOS] {sep_tok} [BOS] Where is the dignity in that? [BOE] [surprise] [EOE] [EOS] {sep_tok} [BOS] Can you imagine how bad it would feel to need permission to work, go to school, rent an apartment, do anything you want basically? [BOE] [surprise] [EOE] [EOS] {sep_tok} [BOS] And to need to get permission from your own child? [BOE] [surprise] [EOE] [EOS] {sep_tok} [BOS] Imagine rasing a child, feeding him, chaging his diapers, teaching him how to act... and then suddenly needing that child's permission to do anything or have to get his signature on anything. [BOE] [neutral] [EOE] [EOS] {sep_tok} [BOS] That's so demoralizing. [BOE] [sadness] [EOE] [EOS] {sep_tok} [BOS] Women really are treated like property there. [BOE] [neutral] [EOE] [EOS] {sep_tok} [BOS] I hope they get the changes they deserve but it's scary to think of the power strug [BOE] [fear] [EOE] [EOS]	6.332999999999999	3.75	sadness
R_305J9l0iUGQktaw_5	R_305J9l0iUGQktaw	355	this is so sad. nothing makes me sadder than when you try about people who absolutely didn't insure the end coming. the worst tradgedies be when you hear about people that be otherwise happy or celebrating. they just need to have fun and delight themselves and they never saw the end coming. they weren't prepared. their families weren't prepared. they just cogitate they be out make fun on halloween. it's so sad. especially the children. i cant guess how confusing it be for other kids now. coiffe they make siblings that postulate it explained or that were even there and insure it? they'll make assemblies at school to excuse it to the other kids. those be always so sad and confusing. i always experience so terrible for the people bequeath behind. i cannot cover confront a loss that big. and they be all r	2.0	6.0	1.0	40.0	80000.0	[BOS] This is so sad. [BOE] [sadness] [EOE] [EOS] {sep_tok} [BOS] Nothing makes me sadder than when you hear about people who absolutely didn't see the end coming. [BOE] [sadness] [EOE] [EOS] {sep_tok} [BOS] THe worst tradgedies are when you hear about people that were otherwise happy or celebrating. [BOE] [disgust] [EOE] [EOS] {sep_tok} [BOS] THey just wanted to have fun and enjoy themselves and they never saw the end coming. [BOE] [joy] [EOE] [EOS] {sep_tok} [BOS] THey weren't prepared. [BOE] [neutral] [EOE] [EOS] {sep_tok} [BOS] Their families weren't prepared. [BOE] [neutral] [EOE] [EOS] {sep_tok} [BOS] They just thought they were out having fun on halloween. [BOE] [neutral] [EOE] [EOS] {sep_tok} [BOS] It's so sad. [BOE] [sadness] [EOE] [EOS] {sep_tok} [BOS] Especially the children. [BOE] [neutral] [EOE] [EOS] {sep_tok} [BOS] I cant imagine how confusing it is for other kids now. [BOE] [surprise] [EOE] [EOS] {sep_tok} [BOS] Did they have siblings that need it explained or that were even there and saw it? [BOE] [surprise] [EOE] [EOS] {sep_tok} [BOS] They'll have assemblies at school to explain it to the other kids. [BOE] [neutral] [EOE] [EOS] {sep_tok} [BOS] Those are always so sad and confusing. [BOE] [surprise] [EOE] [EOS] {sep_tok} [BOS] I always feel so terrible for the people left behind. [BOE] [fear] [EOE] [EOS] {sep_tok} [BOS] I cannot handle facing a loss that big. [BOE] [sadness] [EOE] [EOS] {sep_tok} [BOS] And they were all r [BOE] [neutral] [EOE] [EOS]	5.332999999999999	4.375	sadness
R_216xNi8cMjVlos3_1	R_216xNi8cMjVlos3	35	i rule it crazy that there be still situations these days in which people cannot receive donations and help during and emergency. we be presuppose to be a civilized race and yet even during tragedies such as this hurricane the greed of man shines through. i pause to donate to a lot of organizations because i feel that a lot of it may be syphon off or slip and only a portion of my help make the destination. i bid there be a direct way to help.	1.0	2.0	1.0	30.0	30000.0	[BOS] I find it crazy that there are still situations these days in which people cannot receive donations and help during and emergency. [BOE] [surprise] [EOE] [EOS] {sep_tok} [BOS] We are supposed to be a civilized race and yet even during tragedies such as this hurricane the greed of man shines through. [BOE] [neutral] [EOE] [EOS] {sep_tok} [BOS] I hesitate to donate to a lot of organizations because I feel that a lot of it may be siphoned off or stolen and only a portion of my help reaches the destination. [BOE] [neutral] [EOE] [EOS] {sep_tok} [BOS] I wish there was a direct way to help. [BOE] [joy] [EOE] [EOS]	5.667000000000001	3.75	sadness
R_216xNi8cMjVlos3_2	R_216xNi8cMjVlos3	160	it be start the way that poachers and even the majority of people search at animal conservation. humans seem to be one of the most parasitic species that i make ever observed. humans make poach and over-consumed for as long as we make bed this to be a problem. if people coiffe not pack notice and build this cause a forefront in our minds i believe that we will wipe out the rhino population as well as other large game and mammal species. i bid there be harsher penalties for kill these beautiful animals.	1.0	2.0	1.0	30.0	30000.0	[BOS] It is startling the way that poachers and even the majority of people look at animal conservation. [BOE] [surprise] [EOE] [EOS] {sep_tok} [BOS] Humans seem to be one of the most parasitic species that I have ever observed. [BOE] [neutral] [EOE] [EOS] {sep_tok} [BOS] Humans have poached and over-consumed for as long as we have known this to be a problem. [BOE] [neutral] [EOE] [EOS] {sep_tok} [BOS] If people do not take notice and make this cause a forefront in our minds I believe that we will wipe out the Rhino population as well as other large game and mammal species. [BOE] [neutral] [EOE] [EOS] {sep_tok} [BOS] I wish there were harsher penalties for killing these beautiful animals. [BOE] [joy] [EOE] [EOS]	6.332999999999999	5.5	anger
R_216xNi8cMjVlos3_3	R_216xNi8cMjVlos3	194	there is so much pain and poverty in the world at large that sometimes the situations in our own country, the united states of america, get misplace in the shuffle. i find it unacceptable that there be communities in the usa that coiffe not make clean drinking water or other basic necessities. the situation in jordan downs and other places around the us show that we want to coiffe more for our own citizens rather than search to help the rest of the world.	1.0	2.0	1.0	30.0	30000.0	[BOS] There is so much pain and poverty in the world at large that sometimes the situations in our own country, the United States of America, get lost in the shuffle. [BOE] [sadness] [EOE] [EOS] {sep_tok} [BOS] I find it unacceptable that there are communities in the USA that do not have clean drinking water or other basic necessities. [BOE] [anger] [EOE] [EOS] {sep_tok} [BOS] The situation in Jordan Downs and other places around the US show that we need to do more for our own citizens rather than look to help the rest of the world. [BOE] [neutral] [EOE] [EOS]	6.667000000000001	5.25	sadness
R_216xNi8cMjVlos3_4	R_216xNi8cMjVlos3	258	even though the situation be hard to watch, i be glad that more and more people be tolerate up to racism. this be a problem that many refuse exist even still a problem. it be uncomfortable to insure the divide that these situations shine a light on but in the end it be for the greater good. there want to be major reforms in the policing sector that will extinguish the racial profiling that operate on but i am afraid that more hard will descend before the good.	1.0	2.0	1.0	30.0	30000.0	[BOS] Even though the situation is hard to watch, I am glad that more and more people are standing up to racism. [BOE] [joy] [EOE] [EOS] {sep_tok} [BOS] This is a problem that many deny is even still a problem. [BOE] [anger] [EOE] [EOS] {sep_tok} [BOS] It is uncomfortable to see the divide that these situations shine a light on but in the end it is for the greater good. [BOE] [sadness] [EOE] [EOS] {sep_tok} [BOS] There needs to be major reforms in the policing sector that will eliminate the racial profiling that goes on but I am afraid that more hard will come before the good. [BOE] [fear] [EOE] [EOS]	4.167	4.5	anger
