message_id	response_id	article_id	essay	gender	education	race	age	income	raw_input_emotions	empathy	distress	emotion
R_3QLVVnAgRBRH41U_1	R_3QLVVnAgRBRH41U	13	the level about the line tap is very saddening. especially the constituent in which a infirmary was mistakenly bombed which led to wound and release of life. and the baby we died, that is heartbreaking. it shouldn't be that way, war is an awful, ugly thing. decision like this should be of absolute certainty because of the unjust departure of innocent lives.	1.0	4.0	3.0	20.0	24000.0	[BOS] The story about the air strikes is very saddening. [BOE] [sadness] [EOE] [EOS] {sep_tok} [BOS] Especially the part in which a hospital was mistakenly bombed which led to injuries and loss of life. [BOE] [neutral] [EOE] [EOS] {sep_tok} [BOS] And the children we died, that is heartbreaking. [BOE] [sadness] [EOE] [EOS] {sep_tok} [BOS] It shouldn't be that way, war is an awful, ugly thing. [BOE] [disgust] [EOE] [EOS] {sep_tok} [BOS] Decisions like this should be of absolute certainty because of the unjust loss of innocent lives. [BOE] [joy] [EOE] [EOS]	7.0	7.0	sadness
R_3QLVVnAgRBRH41U_2	R_3QLVVnAgRBRH41U	127	it is clear that climate alteration is something that is not only affecting us, humans. we are not the only fauna that inhabit this world and we should respect all those fauna that live on the earth. especially those who have been here for millions of years. iodin find turtles interesting fauna and i feel like we should do all that we can to ensure the safe and increase of these ancient animals.	1.0	4.0	3.0	20.0	24000.0	[BOS] It is clear that climate change is something that is not only affecting us, humans. [BOE] [neutral] [EOE] [EOS] {sep_tok} [BOS] We are not the only creatures that inhabit this world and we should respect all those animals that live on the earth. [BOE] [neutral] [EOE] [EOS] {sep_tok} [BOS] Especially those who have been here for millions of years. [BOE] [neutral] [EOE] [EOS] {sep_tok} [BOS] I find turtles interesting creatures and I feel like we should do all that we can to ensure the safety and growth of these ancient animals. [BOE] [joy] [EOE] [EOS]	3.167	3.625	sadness
R_3QLVVnAgRBRH41U_3	R_3QLVVnAgRBRH41U	188	iodin did not know this comedian but thinking about how i would feel if my favorite comedian, actor, or artist died; iodin understand the emotional distress and pain that some may feel from this. last is an inevitable thing that affects so many masses daily and to just think about those around you who are here today but may be gone tomorrow is a scary thought.	1.0	4.0	3.0	20.0	24000.0	[BOS] I did not know this comedian but thinking about how I would feel if my favorite comedian, actor, or artist died; [BOE] [surprise] [EOE] [EOS] {sep_tok} [BOS] I understand the emotional distress and pain that some may feel from this. [BOE] [sadness] [EOE] [EOS] {sep_tok} [BOS] Death is an inevitable thing that affects so many people daily and to just think about those around you who are here today but may be gone tomorrow is a scary thought. [BOE] [fear] [EOE] [EOS]	4.5	3.125	fear
R_3QLVVnAgRBRH41U_4	R_3QLVVnAgRBRH41U	307	iodin am an affirmed worshipper that your punishment should fit the crime, but the serviceman is so old so i don't see what the grasp up has been for his sentence. iodin would understand if he was wrongly convicted, but that does not seem to be the case. the judicial organisation needs reclamation because some of the thing that are happening now are appalling.	1.0	4.0	3.0	20.0	24000.0	[BOS] I am an affirmed believer that your punishment should fit the crime, but the man is so old so I don't see what the hold up has been for his sentence. [BOE] [surprise] [EOE] [EOS] {sep_tok} [BOS] I would understand if he was wrongly convicted, but that does not seem to be the case. [BOE] [anger] [EOE] [EOS] {sep_tok} [BOS] The judicial system needs reformation because some of the things that are happening now are appalling. [BOE] [disgust] [EOE] [EOS]	2.0	2.0	anger
R_3QLVVnAgRBRH41U_5	R_3QLVVnAgRBRH41U	409	okay, iodin hate hearing about disease outbreaks. it causes me so much tenseness because you have to fight something that you cannot see. and i am aware of all the medical advancements, but that only really gives me some slice of mind. it would nice to eradicate illness completely. live in a utopian eccentric society.	1.0	4.0	3.0	20.0	24000.0	[BOS] Okay, I hate hearing about disease outbreaks. [BOE] [anger] [EOE] [EOS] {sep_tok} [BOS] It causes me so much stress because you have to fight something that you cannot see. [BOE] [fear] [EOE] [EOS] {sep_tok} [BOS] And I am aware of all the medical advancements, but that only really gives me some piece of mind. [BOE] [surprise] [EOE] [EOS] {sep_tok} [BOS] It would nice to eradicate illness completely. [BOE] [neutral] [EOE] [EOS] {sep_tok} [BOS] Live in a utopian type society. [BOE] [neutral] [EOE] [EOS]	4.5	4.625	anger
R_YbsvqmtcaiZkmrf_1	R_YbsvqmtcaiZkmrf	53	iodin felt pretty neutral when iodin read the article. it didn't really bother me or affect me in any manner emotionally or physically. iodin found it really easy to put out of my nous after reading it as well. it was something that didn't induce any feel in me. iodin did not feel positive nor negative after reading the article.	1.0	4.0	1.0	29.0	80000.0	[BOS] I felt pretty neutral when i read the article. [BOE] [joy] [EOE] [EOS] {sep_tok} [BOS] It didn't really bother me or affect me in any way emotionally or physically. [BOE] [neutral] [EOE] [EOS] {sep_tok} [BOS] I found it really easy to put out of my mind after reading it as well. [BOE] [neutral] [EOE] [EOS] {sep_tok} [BOS] It was something that didn't induce any feelings in me. [BOE] [sadness] [EOE] [EOS] {sep_tok} [BOS] I did not feel positive nor negative after reading the article. [BOE] [anger] [EOE] [EOS]	1.0	1.0	neutral
R_YbsvqmtcaiZkmrf_2	R_YbsvqmtcaiZkmrf	112	my look after reading the article is that it made me feel a bit sad. iodin felt sad because i feel like the crude release and escape are going to affect the wildlife especially the i in the water. iodin am huge on helping fauna and keeping them safe from world harming them. this article definitely put me more on the negative side.	1.0	4.0	1.0	29.0	80000.0	[BOS] My feelings after reading the article is that it made me feel a bit sad. [BOE] [sadness] [EOE] [EOS] {sep_tok} [BOS] I felt sad because i feel like the oil spills and leaks are going to affect the wildlife especially the ones in the water. [BOE] [sadness] [EOE] [EOS] {sep_tok} [BOS] I am huge on helping animals and keeping them safe from humans harming them. [BOE] [joy] [EOE] [EOS] {sep_tok} [BOS] This article definitely put me more on the negative side. [BOE] [anger] [EOE] [EOS]	3.667	2.25	sadness
R_YbsvqmtcaiZkmrf_3	R_YbsvqmtcaiZkmrf	170	my feel towards this article is neutral as well. it did not really make me feel anything. rather yet, it made me feel a scrap bored and i form of dozed off for a bit. iodin felt like it wasn't anything that would impact me or anything i would think twice about. it made me feel mostly relaxed. iodin didn't have nay sorting of positive or negative emotion towards the article.	1.0	4.0	1.0	29.0	80000.0	[BOS] My feelings towards this article is neutral as well. [BOE] [anger] [EOE] [EOS] {sep_tok} [BOS] It did not really make me feel anything. [BOE] [neutral] [EOE] [EOS] {sep_tok} [BOS] Rather yet, it made me feel a bit bored and i kind of dozed off for a bit. [BOE] [sadness] [EOE] [EOS] {sep_tok} [BOS] I felt like it wasn't anything that would impact me or anything i would think twice about. [BOE] [sadness] [EOE] [EOS] {sep_tok} [BOS] It made me feel mostly relaxed. [BOE] [joy] [EOE] [EOS] {sep_tok} [BOS] I didn't have nay sort of positive or negative emotions towards the article. [BOE] [anger] [EOE] [EOS]	1.0	1.0	sadness
R_YbsvqmtcaiZkmrf_4	R_YbsvqmtcaiZkmrf	263	after reading the article, i was definitely a scrap worried and alarmed. the main rationality is because iodin am always very causitous when it comes to sickness and stuff like this. i feel like iodin really have to watch out for myself after reading this article. other than that, i wasn't extremely terrified from the article. i was just more alarmed iodin would say.	1.0	4.0	1.0	29.0	80000.0	[BOS] After reading the article, i was definitely a bit worried and alarmed. [BOE] [fear] [EOE] [EOS] {sep_tok} [BOS] The main reason is because i am always  very causitous when it comes to sickness and stuff like this. [BOE] [neutral] [EOE] [EOS] {sep_tok} [BOS] I feel like i really have to watch out for myself after reading this article. [BOE] [surprise] [EOE] [EOS] {sep_tok} [BOS] Other than that, i wasn't extremely terrified from the article. [BOE] [fear] [EOE] [EOS] {sep_tok} [BOS] I was just more alarmed i would say. [BOE] [fear] [EOE] [EOS]	1.0	1.5	fear
R_YbsvqmtcaiZkmrf_5	R_YbsvqmtcaiZkmrf	364	my feel after reading this article was that it gave me a somewhat negative feeling. iodin tried to see affair from the immigrant's stop of views. iodin tried to see how their kinsfolk would be separated and how hard it would be to see one another. sometimes, they mightnot even be able to see each other again. iodin felt a scrap sad as well.	1.0	4.0	1.0	29.0	80000.0	[BOS] My feelings after reading this article was that it gave me a somewhat negative feeling. [BOE] [sadness] [EOE] [EOS] {sep_tok} [BOS] I tried to see things from the immigrant's point of views. [BOE] [neutral] [EOE] [EOS] {sep_tok} [BOS] I tried to see how their families would be separated and how hard it would be to see one another. [BOE] [surprise] [EOE] [EOS] {sep_tok} [BOS] Sometimes, they mightnot even be able to see each other again. [BOE] [neutral] [EOE] [EOS] {sep_tok} [BOS] I felt a bit sad as well. [BOE] [sadness] [EOE] [EOS]	2.333	1.0	sadness
R_dhyWmQDvtXTFHSp_1	R_dhyWmQDvtXTFHSp	18	there was a bad mistaking that lead to the last of 3 people in jordan recently. they had been on high alarm because of the isi onset and when 3 american went close to the moulding they were shot and killed. it is sad to see this happen to masses when they were just trying to do their job it is very depressing.	1.0	6.0	1.0	32.0	51000.0	[BOS] There was a bad misunderstanding that lead to the deaths of 3 people in Jordan recently. [BOE] [surprise] [EOE] [EOS] {sep_tok} [BOS] They had been on high alert because of the ISIS attacks and when 3 Americans went close to the border they were shot and killed. [BOE] [neutral] [EOE] [EOS] {sep_tok} [BOS] It is sad to see this happen to people when they were just trying to do their job it is very depressing. [BOE] [sadness] [EOE] [EOS]	6.0	5.875	sadness
R_dhyWmQDvtXTFHSp_2	R_dhyWmQDvtXTFHSp	96	global heating is going to be having an effect on the umber trade. as global thaw continues to get worse there is going to be less country that is able to produce coffee. this is going to be bad for the many masses who making their living producing coffee. it is estimated that 125 million masses make their keep this way. this is going to be bad for these masses who are already struggling.	1.0	6.0	1.0	32.0	51000.0	[BOS] Global warming is going to be having an effect on the coffee trade. [BOE] [neutral] [EOE] [EOS] {sep_tok} [BOS] As global warming continues to get worse there is going to be less land that is able to produce coffee. [BOE] [sadness] [EOE] [EOS] {sep_tok} [BOS] This is going to be bad for the many people who making their living producing coffee. [BOE] [sadness] [EOE] [EOS] {sep_tok} [BOS] It is estimated that 125 million people make their living this way. [BOE] [neutral] [EOE] [EOS] {sep_tok} [BOS] This is going to be bad for these people who are already struggling. [BOE] [sadness] [EOE] [EOS]	4.333	4.25	fear
R_dhyWmQDvtXTFHSp_3	R_dhyWmQDvtXTFHSp	210	the stripe that was playing during the onset on the bataclan in france returned there to honor the victim recently. it was very sad because it was such a large and brutal massacre. so many biography were lost that day and for no rationality what so ever. it is just very depressing to think about what those masses must have went through.	1.0	6.0	1.0	32.0	51000.0	[BOS] The band that was playing during the attack on the Bataclan in France returned there to honor the victims recently. [BOE] [neutral] [EOE] [EOS] {sep_tok} [BOS] It was very sad because it was such a large and brutal massacre. [BOE] [sadness] [EOE] [EOS] {sep_tok} [BOS] So many lives were lost that day and for no reason what so ever. [BOE] [sadness] [EOE] [EOS] {sep_tok} [BOS] It is just very depressing to think about what those people must have went through. [BOE] [sadness] [EOE] [EOS]	5.332999999999999	5.5	sadness
R_dhyWmQDvtXTFHSp_4	R_dhyWmQDvtXTFHSp	264	very depressing level iodin read about clime change. it is getting worse and we are going to be experiencing warmer and warmer temperature as the days go on. the serviceman made suit of global thaw are not slowing down and it looks like we will be dealing with worse and worse weather as the days go on. i worry about the hereafter of this planet.	1.0	6.0	1.0	32.0	51000.0	[BOS] Very depressing story I read about climate change. [BOE] [sadness] [EOE] [EOS] {sep_tok} [BOS] It is getting worse and we are going to be experiencing warmer and warmer temperatures as the years go on. [BOE] [disgust] [EOE] [EOS] {sep_tok} [BOS] The man made causes of global warming are not slowing down and it looks like we will be dealing with worse and worse weather as the years go on. [BOE] [disgust] [EOE] [EOS] {sep_tok} [BOS] I worry about the future of this planet. [BOE] [fear] [EOE] [EOS]	3.5	6.875	sadness
R_dhyWmQDvtXTFHSp_5	R_dhyWmQDvtXTFHSp	381	fountainhead fargo honcho were trying to scam the organisation by opening fake accounts. this is something that led to a lot of masses being forced by their honcho to take constituent in this scam. iodin read about one woman who lost her job just because she was following what her honcho told her to do. this poor woman was effected all because masses wanted to be scammers.	1.0	6.0	1.0	32.0	51000.0	[BOS] Wells Fargo bosses were trying to scam the system by opening fake accounts. [BOE] [neutral] [EOE] [EOS] {sep_tok} [BOS] This is something that led to a lot of people being forced by their bosses to take part in this scam. [BOE] [neutral] [EOE] [EOS] {sep_tok} [BOS] I read about one woman who lost her job just because she was following what her boss told her to do. [BOE] [neutral] [EOE] [EOS] {sep_tok} [BOS] This poor woman was effected all because people wanted to be scammers. [BOE] [sadness] [EOE] [EOS]	4.833	4.25	anger
R_vlskxchAPeiideV_1	R_vlskxchAPeiideV	8	that was sad. iodin really felt for those andiron while i read that. it is especially sad for me becuase i have had andiron myself my whole life. the doghouse was iresponsible in its intervention of those dogs. those dogs deserve judge and deserve to be treated as if they were people. as many mass find their dogs to be part of the family.	1.0	4.0	1.0	19.0	40000.0	[BOS] That was sad. [BOE] [sadness] [EOE] [EOS] {sep_tok} [BOS] I really felt for those dogs while I read that. [BOE] [sadness] [EOE] [EOS] {sep_tok} [BOS] It is especially sad for me becuase I have had dogs myself my whole life. [BOE] [sadness] [EOE] [EOS] {sep_tok} [BOS] The kennel was iresponsible in its treatment of those dogs. [BOE] [neutral] [EOE] [EOS] {sep_tok} [BOS] Those dogs deserve justice and deserve to be treated as if they were people. [BOE] [neutral] [EOE] [EOS] {sep_tok} [BOS] As many people find their dogs to be part of the family. [BOE] [neutral] [EOE] [EOS]	3.833	5.75	sadness
R_vlskxchAPeiideV_2	R_vlskxchAPeiideV	114	can you believe the canadian politics did something some terrible. iodin would never expect canada to have something so bad on there record, especially given there reputation. those kinsfolk deserve jurist and any sustenance relatives deserve fixing from the government. this will at least be some justice.	1.0	4.0	1.0	19.0	40000.0	[BOS] Can you believe the Canadian government did something some terrible. [BOE] [surprise] [EOE] [EOS] {sep_tok} [BOS] I would never expect Canada to have something so bad on there record, especially given there reputation. [BOE] [sadness] [EOE] [EOS] {sep_tok} [BOS] Those families deserve justice and any living relatives deserve reparations from the government. [BOE] [neutral] [EOE] [EOS] {sep_tok} [BOS] This will at least be some justice. [BOE] [neutral] [EOE] [EOS]	4.167	6.375	disgust
R_vlskxchAPeiideV_3	R_vlskxchAPeiideV	206	what kirk said was wrong and he should of apologized, which he did. this partially rectifies the situation but it still reflects on him negatively. duckworth's patritism should not of been questioned just because of her heritage. just because she is tai does not mean she is less likely to be devoted to the country.	1.0	4.0	1.0	19.0	40000.0	[BOS] What Kirk said was wrong and he should of apologized, which he did. [BOE] [sadness] [EOE] [EOS] {sep_tok} [BOS] This partially rectifies the situation but it still reflects on him negatively. [BOE] [neutral] [EOE] [EOS] {sep_tok} [BOS] duckworth's patritism should not of been questioned just because of her heritage. [BOE] [neutral] [EOE] [EOS] {sep_tok} [BOS] Just because she is Tai does not mean she is less likely to be devoted to the country. [BOE] [neutral] [EOE] [EOS]	3.667	4.375	anger
R_vlskxchAPeiideV_4	R_vlskxchAPeiideV	322	trump's profits was an upset but it should not of really been that uprising. some polling site gave him a xxx percentage hazard of winning, and clinton was a historical unpopular candidate. the democracts should look within on solving there problems. they should focus on nominating a better candidate the next metre around.	1.0	4.0	1.0	19.0	40000.0	[BOS] Trump's win was an upset but it should not of really been that uprising. [BOE] [surprise] [EOE] [EOS] {sep_tok} [BOS] Some polling sites gave him a thirty percent chance of winning, and Clinton was a historical unpopular candidate. [BOE] [neutral] [EOE] [EOS] {sep_tok} [BOS] The democracts should look within on solving there problems. [BOE] [neutral] [EOE] [EOS] {sep_tok} [BOS] they should focus on nominating a better candidate the next time around. [BOE] [neutral] [EOE] [EOS]	3.667	4.125	neutral
R_vlskxchAPeiideV_5	R_vlskxchAPeiideV	385	trumpet definitely has a republican sentiment in clime change. he is more extreme then most in that he suggests human's may not be responsible at all for clime change. it is clear that world are at least somewhat responsible, but scientist disagree just to what extent world are responsible for the changing climate	1.0	4.0	1.0	19.0	40000.0	[BOS] Trump definitely has a republican view in climate change. [BOE] [neutral] [EOE] [EOS] {sep_tok} [BOS] He is more extreme then most in that he suggests human's may not be responsible at all for climate change. [BOE] [neutral] [EOE] [EOS] {sep_tok} [BOS] It is clear that humans are at least somewhat responsible, but scientists disagree just to what extent humans are responsible for the changing climate [BOE] [neutral] [EOE] [EOS]	3.5	3.875	neutral
R_2e8M8KMUCf35x8Q_1	R_2e8M8KMUCf35x8Q	47	iodin can't even imagine half the hooey that the masses of alep are going though. it must be some form of incubus to get a text that your city is going to be bombed. i'm really thankful that you joined the reserves and not something that'd get you deployed. i'm grateful that iodin have you and a much more stable country.	1.0	6.0	1.0	28.0	11000.0	[BOS] I can't even imagine half the stuff that the people of Aleppo are going though. [BOE] [sadness] [EOE] [EOS] {sep_tok} [BOS] It must be some kind of nightmare to get a text that your city is going to be bombed. [BOE] [fear] [EOE] [EOS] {sep_tok} [BOS] I'm really thankful that you joined the reserves and not something that'd get you deployed. [BOE] [joy] [EOE] [EOS] {sep_tok} [BOS] I'm grateful that I have you and a much more stable country. [BOE] [joy] [EOE] [EOS]	5.167000000000001	5.875	fear
R_2e8M8KMUCf35x8Q_2	R_2e8M8KMUCf35x8Q	97	hey here's a list of some affair you might want to look into before you put them into your body, i don't know how trustworthy the germ is but better safe than sorry right? last thing we want is something bad to happen to one of us. iodin know you're on a scrap of a health beef so i have no thought what you've been up to on that front, just letting you know i fear though.	1.0	6.0	1.0	28.0	11000.0	[BOS] Hey here's a list of some things you might want to look into before you put them into your body, I don't know how trustworthy the source is but better safe than sorry right? [BOE] [surprise] [EOE] [EOS] {sep_tok} [BOS] Last thing we want is something bad to happen to one of us. [BOE] [neutral] [EOE] [EOS] {sep_tok} [BOS] I know you're on a bit of a health kick so I have no idea what you've been up to on that front, just letting you know I care though. [BOE] [joy] [EOE] [EOS]	1.0	1.375	fear
R_2e8M8KMUCf35x8Q_3	R_2e8M8KMUCf35x8Q	243	here's a level on the crazies from up in or that got off manner too lightly. just a symptom of the larger issue this country is having with far right extremist taking advantage of a organisation that wants to help them at the disbursal of the residue of the nation. honestly oregon has been looking pretty darn bad recently	1.0	6.0	1.0	28.0	11000.0	[BOS] Here's a story on the crazies from up in Oregon that got off way too lightly. [BOE] [neutral] [EOE] [EOS] {sep_tok} [BOS] Just a symptom of the larger issues this country is having with far right extremists taking advantage of a system that wants to help them at the expense of the rest of the nation. [BOE] [neutral] [EOE] [EOS] {sep_tok} [BOS] Honestly Oregon has been looking pretty darn bad recently [BOE] [sadness] [EOE] [EOS]	1.0	1.0	sadness
R_2e8M8KMUCf35x8Q_4	R_2e8M8KMUCf35x8Q	290	lucky we don't go to the beach much eh? but really it's kinda spooky that these affair are increasing. probably something to do with global thaw in a agency we don't understand yet. i'm already afraid enough of open water, don't need to be thinking about sharks even closer to land. iodin know it's australia, but florida isn't that much different.	1.0	6.0	1.0	28.0	11000.0	[BOS] Lucky we don't go to the beach much eh? [BOE] [surprise] [EOE] [EOS] {sep_tok} [BOS] But really it's kinda spooky that these things are increasing. [BOE] [fear] [EOE] [EOS] {sep_tok} [BOS] Probably something to do with global warming in a way we don't understand yet. [BOE] [surprise] [EOE] [EOS] {sep_tok} [BOS] I'm already afraid enough of open water, don't need to be thinking about sharks even closer to land. [BOE] [fear] [EOE] [EOS] {sep_tok} [BOS] I know it's Australia, but Florida isn't that much different. [BOE] [neutral] [EOE] [EOS]	3.167	1.0	fear
R_2e8M8KMUCf35x8Q_5	R_2e8M8KMUCf35x8Q	342	yeah ussr has some real distinct issue for the underclasses which is super ironic given it's history. the oligarchy in plaza wants masses to have just enough to survive and not complain, because they know the russian masses can be brought to bear against a mighty nation. it's happened twice so far.	1.0	6.0	1.0	28.0	11000.0	[BOS] Yeah Russia has some real distinct issues for the underclasses which is super ironic given it's history. [BOE] [neutral] [EOE] [EOS] {sep_tok} [BOS] The oligarchy in place wants people to have just enough to survive and not complain, because they know the Russian people can be brought to bear against a mighty nation. [BOE] [neutral] [EOE] [EOS] {sep_tok} [BOS] It's happened twice so far. [BOE] [neutral] [EOE] [EOS]	3.667	2.25	neutral
R_2CKuUANCcIJpwIr_1	R_2CKuUANCcIJpwIr	9	it's utter destruction in new zealand after suffering one of the worst earthquake in 2011 the south island was pummeled with another two earthquake and it's aftershock could be felt throughout the whole island. the field is completely devastated and looks like a ghostwriter town because of all the hurt and danger from the downed power lines.	1.0	5.0	2.0	30.0	75000.0	[BOS] It's utter devastation in New Zealand after suffering one of the worst earthquakes in 2011 the South Island was pummeled with another two earthquakes and it's aftershocks could be felt throughout the whole island. [BOE] [fear] [EOE] [EOS] {sep_tok} [BOS] The area is completely devastated and looks like a ghost town because of all the damage and danger from the downed power lines. [BOE] [sadness] [EOE] [EOS]	2.667	2.25	sadness
R_2CKuUANCcIJpwIr_2	R_2CKuUANCcIJpwIr	105	it sickens me that more of these third world country are receiving the assist they deserve so that the nestling can be healed and fed and not suffer the disease that are out there this time it is measles that is killing children in northern sudan. it makes me sad that this is just an everyday thing to this country and if nobody is helping then more and more nestling will die because masses don't care about them.	1.0	5.0	2.0	30.0	75000.0	[BOS] It sickens me that more of these third world countries are receiving the aid they deserve so that the kids can be healed and fed and not suffer the diseases that are out there this time it is measles that is killing children in northern Sudan. [BOE] [sadness] [EOE] [EOS] {sep_tok} [BOS] It makes me sad that this is just an everyday thing to this country and if nobody is helping then more and more children will die because people don't care about them. [BOE] [sadness] [EOE] [EOS]	1.6669999999999998	1.625	sadness
