message_id	response_id	article_id	essay	gender	education	race	age	income	raw_input_emotions	empathy	distress	emotion
R_1Kl28hxlafnzQ6V_2	R_1Kl28hxlafnzQ6V	95	can you believe some people still don't believe in climate change? when will people, especially americans like donald trump, ignite up? what be it operate to pack to start them to start urinate a difference. we survive in connecticut, guess our entire state burning up! what serve climate change deniers cogitate be really have this then? bunch of idiots in congress who don't care. we be misplace our forests and animals and it just so sad.	2.0	6.0	1.0	37.0	135000.0	[BOS] Can you believe some people still don't believe in climate change? [BOE] [surprise] [EOE] [EOS] {sep_tok} [BOS] When will people, especially Americans like Donald Trump, wake up? [BOE] [surprise] [EOE] [EOS] {sep_tok} [BOS] What is it going to take to get them to start making a difference. [BOE] [surprise] [EOE] [EOS] {sep_tok} [BOS] We live in Connecticut, imagine our ENTIRE state burning up! [BOE] [neutral] [EOE] [EOS] {sep_tok} [BOS] What do climate change deniers think is really causing this then? [BOE] [surprise] [EOE] [EOS] {sep_tok} [BOS] Bunch of idiots in congress who don't care. [BOE] [anger] [EOE] [EOS] {sep_tok} [BOS] We are losing our forests and animals and it just so sad. [BOE] [sadness] [EOE] [EOS]	3.333	7.0	surprise
R_1Kl28hxlafnzQ6V_3	R_1Kl28hxlafnzQ6V	226	of course donald trump would try to downplay the state of the african american community. it be sad and upset that murder rates make surface so much, over 10 percent in one year. and most of the victims be african american men. this be a criss. bequeath it to donald to try to traverse it under the rug. moreover, violent crime make increase by over 2%. even though this be debate a low increase, why aren't we sharpen on make a decrease instead of just accepting a lower increase? also, that bus crash sounds so scary, i'm glad no one be seriously injured.	2.0	6.0	1.0	37.0	135000.0	[BOS] Of course Donald Trump would try to downplay the state of the African American community. [BOE] [neutral] [EOE] [EOS] {sep_tok} [BOS] It is sad and disturbing that murder rates have risen so much, over 10 percent in one year. [BOE] [sadness] [EOE] [EOS] {sep_tok} [BOS] And most of the victims are african american men. [BOE] [neutral] [EOE] [EOS] {sep_tok} [BOS] This is a criss. [BOE] [neutral] [EOE] [EOS] {sep_tok} [BOS] Leave it to Donald to try to sweep it under the rug. [BOE] [neutral] [EOE] [EOS] {sep_tok} [BOS] Moreover, violent crime has increased by over 2%. [BOE] [neutral] [EOE] [EOS] {sep_tok} [BOS] Even though this is considered a low increase, why aren't we focusing on having a DECREASE instead of just accepting a lower increase? [BOE] [surprise] [EOE] [EOS] {sep_tok} [BOS] Also, that bus crash sounds so scary, I'm glad no one was seriously injured. [BOE] [fear] [EOE] [EOS]	1.0	6.0	fear
R_1Kl28hxlafnzQ6V_4	R_1Kl28hxlafnzQ6V	304	register about children down themselves exist very upsetting. it be nice to register that less children be exit in car accidents, though. i wonder if it's because of safer cars, car seat laws or what? but the suicide thing be so very sad. i make three kids and can't guess if this happen to one of them. i inquire what make have this uptick in teen suicides? maybe the rise of social media? maybe the financial crisis of 2008 didn't help, have problems with adults in the home. it's be a very stressful time ever since then for a lot of families.	2.0	6.0	1.0	37.0	135000.0	[BOS] Reading about children killing themselves is very upsetting. [BOE] [sadness] [EOE] [EOS] {sep_tok} [BOS] It is nice to read that less children are dying in car accidents, though. [BOE] [joy] [EOE] [EOS] {sep_tok} [BOS] I  wonder if it's because of safer cars, car seat laws or what? [BOE] [surprise] [EOE] [EOS] {sep_tok} [BOS] But the suicide thing is so very sad. [BOE] [sadness] [EOE] [EOS] {sep_tok} [BOS] I have three kids and can't imagine if this happened to one of them. [BOE] [surprise] [EOE] [EOS] {sep_tok} [BOS] I wonder what has caused this uptick in teen suicides? [BOE] [surprise] [EOE] [EOS] {sep_tok} [BOS] Maybe the rise of social media? [BOE] [neutral] [EOE] [EOS] {sep_tok} [BOS] Maybe the financial crisis of 2008 didn't help, causing problems with adults in the home. [BOE] [sadness] [EOE] [EOS] {sep_tok} [BOS] It's been a very stressful time ever since then for a lot of families. [BOE] [fear] [EOE] [EOS]	3.0	7.0	sadness
R_1Kl28hxlafnzQ6V_5	R_1Kl28hxlafnzQ6V	352	this be extremely disturbing! what kind of backward country be dubai? how can these men just vaporize home like nothing happened? this poor woman! let this be a message to discontinue tourism to dubai. you never bed what can happen. i feel so bad for this woman. i hope in the end, justice start process to these men somehow and the woman be able to operate free. she should not make to give a dime! how ridiculous.	2.0	6.0	1.0	37.0	135000.0	[BOS] This is extremely disturbing! [BOE] [fear] [EOE] [EOS] {sep_tok} [BOS] What kind of backward country is Dubai? [BOE] [surprise] [EOE] [EOS] {sep_tok} [BOS] How can these men just fly home like nothing happened? [BOE] [surprise] [EOE] [EOS] {sep_tok} [BOS] This poor woman! [BOE] [sadness] [EOE] [EOS] {sep_tok} [BOS] Let this be a message to stop tourism to Dubai. [BOE] [neutral] [EOE] [EOS] {sep_tok} [BOS] You never know what can happen. [BOE] [joy] [EOE] [EOS] {sep_tok} [BOS] I feel so bad for this woman. [BOE] [sadness] [EOE] [EOS] {sep_tok} [BOS] I hope in the end, justice gets served to these men somehow and the woman is able to go free. [BOE] [joy] [EOE] [EOS] {sep_tok} [BOS] She should not have to pay a dime! [BOE] [neutral] [EOE] [EOS] {sep_tok} [BOS] How ridiculous. [BOE] [anger] [EOE] [EOS]	6.167000000000001	7.0	anger
R_cFNbZubxstepj4B_1	R_cFNbZubxstepj4B	37	hi bob, i just register this article on a suicide bombing attack in afghanistan and it truly wrack my heart. i need you to pack a look at this and recount me how you feel. becareful out there. i bed you be deployed in iraq but still, the same thing can happen. always determine your back and i'll be implore for you everyday.	5.0	4.0	5.0	25.0	50000.0	[BOS] Hi Bob, I just read this article on a suicide bombing attack in Afghanistan and it truly wrecked my heart. [BOE] [sadness] [EOE] [EOS] {sep_tok} [BOS] I want you to take a look at this and tell me how you feel. [BOE] [joy] [EOE] [EOS] {sep_tok} [BOS] Becareful out there. [BOE] [neutral] [EOE] [EOS] {sep_tok} [BOS] I know you are deployed in Iraq but still, the same thing can happen. [BOE] [neutral] [EOE] [EOS] {sep_tok} [BOS] Always watch your back and I'll be praying for you everyday. [BOE] [joy] [EOE] [EOS]	1.6669999999999998	4.625	sadness
R_cFNbZubxstepj4B_2	R_cFNbZubxstepj4B	113	hi monique, fit out this article i register on fume be slowly banned near playgrounds and areas where children play. i cogitate you'll like this article just as much as i did, as we both bed that smoking has once be a big part of our lives until just last year. i need to corroborate and be active in the politics of ban smoking in certain areas where children be present.	5.0	4.0	5.0	25.0	50000.0	[BOS] Hi Monique, check out this article I read on smoking being slowly banned near playgrounds and areas where children play. [BOE] [neutral] [EOE] [EOS] {sep_tok} [BOS] I think you'll like this article just as much as I did, as we both know that smoking has once been a big part of our lives until just last year. [BOE] [joy] [EOE] [EOS] {sep_tok} [BOS] I want to support and be active in the politics of banning smoking in certain areas where children are present. [BOE] [joy] [EOE] [EOS]	2.667	1.875	joy
R_cFNbZubxstepj4B_3	R_cFNbZubxstepj4B	216	hiro, both you and i bed how much we both dislike donald trump, along with millions of others out there. this article make only reenforce my dislike for such a leadership we make got. he be quite the disgrace to our nation as americans and i just need to register you this article pronounce that not only make he build our nation worse off than it was, he be operate to pack it over and made it into a living hell for millions out there.	5.0	4.0	5.0	25.0	50000.0	[BOS] Hiro, both you and I know how much we both dislike Donald Trump, along with millions of others out there. [BOE] [neutral] [EOE] [EOS] {sep_tok} [BOS] This article has only reinforced my dislike for such a leadership we have got. [BOE] [anger] [EOE] [EOS] {sep_tok} [BOS] He is quite the disgrace to our nation as Americans and I just want to show you this article saying that not only has he made our nation worse off than it was, he is going to take it over and made it into a living hell for millions out there. [BOE] [sadness] [EOE] [EOS]	1.0	1.625	anger
R_cFNbZubxstepj4B_4	R_cFNbZubxstepj4B	285	hi mo, recall when we scuba plunge in hawaii to search at the reefs up close and how blown away we be of how such a structure be home to thousands of different little creatures and species. well, this article be now tell that its slowly dying and theres not much we can coiffe about it. this breaks my heart and i cogitate i'd share this with you.	5.0	4.0	5.0	25.0	50000.0	[BOS] Hi Mo, remember when we scuba dived in Hawaii to look at the reefs up close and how blown away we were of how such a structure is home to thousands of different little creatures and species. [BOE] [surprise] [EOE] [EOS] {sep_tok} [BOS] Well, this article is now saying that its slowly dying and theres not much we can do about it. [BOE] [neutral] [EOE] [EOS] {sep_tok} [BOS] This breaks my heart and I thought I'd share this with you. [BOE] [sadness] [EOE] [EOS]	3.0	3.5	sadness
R_cFNbZubxstepj4B_5	R_cFNbZubxstepj4B	392	hi friend, this article excuse why certain species be very difficult to save from extinction. because of it's exponential rate of death within each species it exist just not possible to save all of a single species and maintain it to stabilise it's population. some species would just make to keep it's ordinary rate and fall out.	5.0	4.0	5.0	25.0	50000.0	[BOS] Hi friend, this article explains why certain species are very difficult to save from extinction. [BOE] [neutral] [EOE] [EOS] {sep_tok} [BOS] Because of it's exponential rate of death within each species it is just not possible to save all of a single species and maintain it to stabilize it's population. [BOE] [neutral] [EOE] [EOS] {sep_tok} [BOS] Some species would just have to maintain it's ordinary rate and fall out. [BOE] [neutral] [EOE] [EOS]	3.167	2.375	neutral
R_22X2pRoSBPFeOE9_1	R_22X2pRoSBPFeOE9	1	"it search like a little boy start shoot with a bottle at the sports game. what shine me funny be that they're holler it ""abhorent"" but the bit about the kid just pronounce ""may comprise bequeath with a scar."" oh man, an 11 year old with a scar be pretty terrifying. at least he got a good story out of it. it's a shame, but what coiffe you look at headed sporting events?"	2.0	6.0	1.0	31.0	34999.0	"[BOS] It looks like a little boy got hit with a bottle at the sports game. [BOE] [neutral] [EOE] [EOS] {sep_tok} [BOS] What strikes me funny is that they're calling it ""abhorent"" but the bit about the kid just said ""may be left with a scar."" [BOE] [joy] [EOE] [EOS] {sep_tok} [BOS] Oh man, an 11 year old with a scar is pretty terrifying. [BOE] [fear] [EOE] [EOS] {sep_tok} [BOS] At least he got a good story out of it. [BOE] [joy] [EOE] [EOS] {sep_tok} [BOS] It's a shame, but what do you expect at headed sporting events? [BOE] [sadness] [EOE] [EOS]"	6.0	4.875	fear
R_22X2pRoSBPFeOE9_2	R_22X2pRoSBPFeOE9	145	"most people just start ""sick and tired"" about try the elections, on either side, and didn't need to bother with it anymore. i cogitate it's partially responsible for trump beat elected. you can't lam the news when it's on every device that you've got, and most people are register the news on their devices when they apply to be search at their friends."	2.0	6.0	1.0	31.0	34999.0	"[BOS] Most people just got ""sick and tired"" about hearing the elections, on either side, and didn't want to bother with it anymore. [BOE] [sadness] [EOE] [EOS] {sep_tok} [BOS] I think it's partially responsible for Trump getting elected. [BOE] [neutral] [EOE] [EOS] {sep_tok} [BOS] You can't escape the news when it's on every device that you've got, and most people are reading the news on their devices when they used to be looking at their friends. [BOE] [neutral] [EOE] [EOS]"	3.0	5.625	disgust
R_22X2pRoSBPFeOE9_3	R_22X2pRoSBPFeOE9	218	"i can't believe that ""acceptable if filtered"" be now the standard we're consent for water. no one's pack the fall for this and it sound like places all over the country be start dangerous drinking water that they've start to give to filter. it's really scary that nothing be be done. flint look terrible and i can't guess those contaminants be good for anyone's health, even if the fda pronounce they're ""acceptable."""	2.0	6.0	1.0	31.0	34999.0	"[BOS] I can't believe that ""acceptable if filtered"" is now the standard we're accepting for water. [BOE] [surprise] [EOE] [EOS] {sep_tok} [BOS] No one's taking the fall for this and it sounds like places all over the country are getting dangerous drinking water that they've got to pay to filter. [BOE] [neutral] [EOE] [EOS] {sep_tok} [BOS] It's really scary that nothing is being done. [BOE] [fear] [EOE] [EOS] {sep_tok} [BOS] Flint looked terrible and I can't imagine those contaminants are good for anyone's health, even if the FDA says they're ""acceptable."" [BOE] [fear] [EOE] [EOS]"	4.0	6.0	fear
R_22X2pRoSBPFeOE9_4	R_22X2pRoSBPFeOE9	328	"some of the phrases in this article really build me fear for the state of our country. some people really really need to cheapen others and pinhole women, and it's suit more and more socially acceptable. look at our president and some of the things he make said! i don't cogitate people in authority especially should be apply free passes anymore or the excuse to pronounce ""just words"""	2.0	6.0	1.0	31.0	34999.0	"[BOS] Some of the phrases in this article really made me fear for the state of our country. [BOE] [fear] [EOE] [EOS] {sep_tok} [BOS] Some people really really want to degrade others and pinhole women, and it's becoming more and more socially acceptable. [BOE] [neutral] [EOE] [EOS] {sep_tok} [BOS] Look at our president and some of the things he has said! [BOE] [neutral] [EOE] [EOS] {sep_tok} [BOS] I don't think people in authority especially should be given free passes anymore or the excuse to say ""just words"" [BOE] [anger] [EOE] [EOS]"	2.0	7.0	anger
R_22X2pRoSBPFeOE9_5	R_22X2pRoSBPFeOE9	402	i detest that refugees can fly from one crisis and rule themselves in another one. it sound like this is a good thing to close, but i interest what will happen to those poor people next. it sound like there be a lot of oversight and a lot of people with good intentions but bad execution. i hope there's some hope for refugees all over the world.	2.0	6.0	1.0	31.0	34999.0	[BOS] I hate that refugees can flee from one crisis and find themselves in another one. [BOE] [anger] [EOE] [EOS] {sep_tok} [BOS] It sounds like this is a good thing to close, but I worry what will happen to those poor people next. [BOE] [fear] [EOE] [EOS] {sep_tok} [BOS] It sounds like there was a lot of oversight and a lot of people with good intentions but bad execution. [BOE] [sadness] [EOE] [EOS] {sep_tok} [BOS] I hope there's some hope for refugees all over the world. [BOE] [joy] [EOE] [EOS]	5.0	4.5	sadness
R_1GBlyhxWBx4ybH6_1	R_1GBlyhxWBx4ybH6	67	everyone be quetch about immigration and bury the actual people involved. if these people make any option other than to look almost certain death, surely they would make pack it. i wouldn't wish these conditions on my worst enemy. i bid there be a way for people to feel the sort of terror and helplessness that direct people to these drastic options in order to interpret better what they're operate through.	2.0	7.0	1.0	34.0	53000.0	[BOS] Everyone is complaining about immigration and forgetting the actual people involved. [BOE] [anger] [EOE] [EOS] {sep_tok} [BOS] If these people had any option other than to face almost certain death, surely they would have taken it. [BOE] [neutral] [EOE] [EOS] {sep_tok} [BOS] I wouldn't wish these conditions on my worst enemy. [BOE] [anger] [EOE] [EOS] {sep_tok} [BOS] I wish there was a way for people to experience the sort of terror and helplessness that leads people to these drastic options in order to understand better what they're going through. [BOE] [joy] [EOE] [EOS]	4.667	7.0	sadness
R_1GBlyhxWBx4ybH6_2	R_1GBlyhxWBx4ybH6	152	a lot of us coiffe what we can to frown our emissions and pollution, even still, this study shouldn't be surprising to anyone. of course the poor air be wound people, we're envenom the children and profit be all that really matters in the end, nothing will modify until you force it to. if everyone coiffe the most they could coiffe we might feature a shot at decoct or overthrow some of this damage, but as it be it's obviously not modify and it's hurting people's lives.	2.0	7.0	1.0	34.0	53000.0	[BOS] A lot of us do what we can to lower our emissions and pollution, even still, this study shouldn't be surprising to anyone. [BOE] [neutral] [EOE] [EOS] {sep_tok} [BOS] Of course the poor air is hurting people, we're poisoning the children and profit is all that really matters in the end, nothing will change until you force it to. [BOE] [sadness] [EOE] [EOS] {sep_tok} [BOS] If everyone did the most they could do we might have a shot at reducing or reversing some of this damage, but as it is it's obviously not changing and it's hurting people's lives. [BOE] [sadness] [EOE] [EOS]	3.0	7.0	sadness
R_1GBlyhxWBx4ybH6_3	R_1GBlyhxWBx4ybH6	247	"the ""wave of aggression""on muslims after the attacks exist exactly the same kind of foolishness that make lead us into wars. when will people interpret that violence isn't the answer? why be it always such an easy pick for certain people to determine who they're operate to operate after and who they're operate to blame? one or two bad eggs coiffe not break an entire people and an entire culture of people. what make break an entire culture, be the constant finger pointing and knee jerk reaction to fault anyone who be ""other."""	2.0	7.0	1.0	34.0	53000.0	"[BOS] The ""wave of aggression""on Muslims after the attacks is exactly the same kind of foolishness that has lead us into wars. [BOE] [anger] [EOE] [EOS] {sep_tok} [BOS] When will people understand that violence isn't the answer? [BOE] [surprise] [EOE] [EOS] {sep_tok} [BOS] Why is it always such an easy pick for certain people to decide who they're going to go after and who they're going to blame? [BOE] [surprise] [EOE] [EOS] {sep_tok} [BOS] One or two bad eggs does not ruin an entire people and an entire culture of people. [BOE] [anger] [EOE] [EOS] {sep_tok} [BOS] What does ruin an entire culture, is the constant finger pointing and knee jerk reaction to blame anyone who is ""other."" [BOE] [anger] [EOE] [EOS]"	4.833	7.0	anger
R_1GBlyhxWBx4ybH6_4	R_1GBlyhxWBx4ybH6	294	this be really interesting. park, who isn't the worst leader by any stretch of the imagination, still is start backlash for her behavior and the people and students be register their distaste. the protesters be peaceful and well talk and everything be clear, they bed what they want and be share it. why can't we be more like this in america? we make a liar for a president, and nobody be stay in the streets until it's taken care of.	2.0	7.0	1.0	34.0	53000.0	[BOS] This is really interesting. [BOE] [joy] [EOE] [EOS] {sep_tok} [BOS] Park, who isn't the worst leader by any stretch of the imagination, still is getting backlash for her behavior and the people and students are showing their distaste. [BOE] [neutral] [EOE] [EOS] {sep_tok} [BOS] The protesters are peaceful and well spoken and everything is clear, they know what they want and are sharing it. [BOE] [neutral] [EOE] [EOS] {sep_tok} [BOS] Why can't we be more like this in America? [BOE] [surprise] [EOE] [EOS] {sep_tok} [BOS] We have a liar for a president, and nobody is remaining in the streets until it's taken care of. [BOE] [anger] [EOE] [EOS]	6.332999999999999	4.5	surprise
R_1GBlyhxWBx4ybH6_5	R_1GBlyhxWBx4ybH6	365	this be insane. anyone who make vaporize into heathrow bed it's start so many fields around it, why ruin it? isn't it a big enough airport already? and with london make issues as it be with air pollution, why try to append to it for no reason at all? this be outrageous and i hope they fight it every step of the way.	2.0	7.0	1.0	34.0	53000.0	[BOS] This is insane. [BOE] [anger] [EOE] [EOS] {sep_tok} [BOS] Anyone who has flown into Heathrow knows it's got so many fields around it, why ruin it? [BOE] [surprise] [EOE] [EOS] {sep_tok} [BOS] Isn't it a big enough airport already? [BOE] [surprise] [EOE] [EOS] {sep_tok} [BOS] And with London having issues as it is with air pollution, why try to add to it for no reason at all? [BOE] [surprise] [EOE] [EOS] {sep_tok} [BOS] This is outrageous and I hope they fight it every step of the way. [BOE] [joy] [EOE] [EOS]	4.833	6.375	anger
R_29bJ1I48nZeZttg_1	R_29bJ1I48nZeZttg	36	what a terrible tragedy,richard hong be rule dead. i make try the name before but i don't cogitate i feature ever insure him behave in anything though. i inquire what happen? hope the police inquire the situation thoroughly.i wonder if he exit from natural causes or be a result of foul play.whatever the cause it's terrible,my thoughts and prays operate out to his family and friends.	1.0	2.0	1.0	30.0	55000.0	[BOS] what a terrible tragedy,Richard Hong was found dead. [BOE] [fear] [EOE] [EOS] {sep_tok} [BOS] i have heard the name before but i don't think i have ever seen him acting in anything though. [BOE] [neutral] [EOE] [EOS] {sep_tok} [BOS] i wonder what happen? [BOE] [surprise] [EOE] [EOS] {sep_tok} [BOS] hope the police investigate the situation thoroughly.i wonder if he died from natural causes or was a result of foul play. [BOE] [joy] [EOE] [EOS] {sep_tok} [BOS] Whatever the cause it's terrible,my thoughts and prays go out to his family and friends. [BOE] [fear] [EOE] [EOS]	3.0	2.875	sadness
R_29bJ1I48nZeZttg_2	R_29bJ1I48nZeZttg	150	she be only 30 years old,so sad.she be a pioneer and i'm sure she will exist greatly missed. i question the training these women experience in china,i make no doubt that the chinese military/government push people beyond their limitations so that they will search good to outsiders,it's such a shame! many chinese citizens online be also interrogate the quality of the pilots equipment and quality of training!	1.0	2.0	1.0	30.0	55000.0	[BOS] She was only 30 years old,so sad.she was a pioneer and i'm sure she will be greatly missed. [BOE] [sadness] [EOE] [EOS] {sep_tok} [BOS] i question the training these women receive in china,i have no doubt that the Chinese military/government push people beyond their limitations so that they will look good to outsiders,it's such a shame! [BOE] [sadness] [EOE] [EOS] {sep_tok} [BOS] Many Chinese citizens online are also questioning the quality of the pilots equipment and quality of training! [BOE] [neutral] [EOE] [EOS]	3.5	3.375	sadness
R_29bJ1I48nZeZttg_3	R_29bJ1I48nZeZttg	198	this guy be a total disgrace to all gun owners and i am happy justice is be served.not only coiffe needlessly pack the life of an innocent young man but he also through away his own life...for what? because the teenagers be diddle loud music? so sickening! i can't believe this guy cogitate this be a viable defense. this moron also build it harder for people who actually justifiably maintain themselves via the stand your ground law.....an all around terrible situation,just glad he be be hurl in prison	1.0	2.0	1.0	30.0	55000.0	[BOS] This guy is a total disgrace to all gun owners and i am happy justice is being served.not only did needlessly take the life of an innocent young man but he also through away his own life...for what? [BOE] [sadness] [EOE] [EOS] {sep_tok} [BOS] because the teenagers were playing loud music? [BOE] [surprise] [EOE] [EOS] {sep_tok} [BOS] so sickening! [BOE] [fear] [EOE] [EOS] {sep_tok} [BOS] i can't believe this guy thought this was a viable defense. [BOE] [surprise] [EOE] [EOS] {sep_tok} [BOS] This moron also makes it harder for people who actually justifiably defend themselves via the stand your ground law.....an all around terrible situation,just glad he is being thrown in prison [BOE] [fear] [EOE] [EOS]	2.5	3.25	disgust
R_29bJ1I48nZeZttg_4	R_29bJ1I48nZeZttg	257	"while i exist sympathetic to the students of new delh who be sick of respire in the pollution,i don't insure how they could possibly look the government to ""do something"" in a manner and time frame that they seem to be look for. just how fast coiffe they cogitate this problem can be fixed? it will be a huge undertaking and the students ask to interpret this.they should coiffe weekly resist in the long term instead of blow time and coiffe one ""long protest""."	1.0	2.0	1.0	30.0	55000.0	"[BOS] While i am sympathetic to the students of New Delh who are sick of breathing in the pollution,i don't see how they could possibly expect the government to ""do something"" in a manner and time frame that they seem to be looking for. [BOE] [anger] [EOE] [EOS] {sep_tok} [BOS] just how fast do they think this problem can be fixed? [BOE] [surprise] [EOE] [EOS] {sep_tok} [BOS] it will be a huge undertaking and the students need to understand this.they should do weekly protest in the long term instead of wasting time and doing one ""long protest"". [BOE] [neutral] [EOE] [EOS]"	1.0	1.5	anger
