message_id	response_id	article_id	essay	gender	education	race	age	income	raw_input_emotions	empathy	distress	emotion
R_3QLVVnAgRBRH41U_1	R_3QLVVnAgRBRH41U	13	the story about the air strikes be very saddening. especially the part in which a hospital be mistakenly flunk which direct to injuries and loss of life. and the children we died, that be heartbreaking. it shouldn't be that way, war be an awful, ugly thing. decisions like this should be of absolute certainty because of the unjust loss of innocent lives.	1.0	4.0	3.0	20.0	24000.0	[BOS] The story about the air strikes is very saddening. [BOE] [sadness] [EOE] [EOS] {sep_tok} [BOS] Especially the part in which a hospital was mistakenly bombed which led to injuries and loss of life. [BOE] [neutral] [EOE] [EOS] {sep_tok} [BOS] And the children we died, that is heartbreaking. [BOE] [sadness] [EOE] [EOS] {sep_tok} [BOS] It shouldn't be that way, war is an awful, ugly thing. [BOE] [disgust] [EOE] [EOS] {sep_tok} [BOS] Decisions like this should be of absolute certainty because of the unjust loss of innocent lives. [BOE] [joy] [EOE] [EOS]	7.0	7.0	sadness
R_3QLVVnAgRBRH41U_2	R_3QLVVnAgRBRH41U	127	it be clear that climate change be something that be not only sham us, humans. we be not the only creatures that live this world and we should prize all those animals that survive on the earth. especially those who make been here for millions of years. i rule turtles worry creatures and i experience like we should coiffe all that we can to ensure the safety and growth of these ancient animals.	1.0	4.0	3.0	20.0	24000.0	[BOS] It is clear that climate change is something that is not only affecting us, humans. [BOE] [neutral] [EOE] [EOS] {sep_tok} [BOS] We are not the only creatures that inhabit this world and we should respect all those animals that live on the earth. [BOE] [neutral] [EOE] [EOS] {sep_tok} [BOS] Especially those who have been here for millions of years. [BOE] [neutral] [EOE] [EOS] {sep_tok} [BOS] I find turtles interesting creatures and I feel like we should do all that we can to ensure the safety and growth of these ancient animals. [BOE] [joy] [EOE] [EOS]	3.167	3.625	sadness
R_3QLVVnAgRBRH41U_3	R_3QLVVnAgRBRH41U	188	i did not know this comedian but cogitate about how i would feel if my favorite comedian, actor, or artist died; i interpret the emotional distress and pain that some may feel from this. death be an inevitable thing that sham so many people daily and to just cogitate about those around you who be here today but may be operate tomorrow be a scary thought.	1.0	4.0	3.0	20.0	24000.0	[BOS] I did not know this comedian but thinking about how I would feel if my favorite comedian, actor, or artist died; [BOE] [surprise] [EOE] [EOS] {sep_tok} [BOS] I understand the emotional distress and pain that some may feel from this. [BOE] [sadness] [EOE] [EOS] {sep_tok} [BOS] Death is an inevitable thing that affects so many people daily and to just think about those around you who are here today but may be gone tomorrow is a scary thought. [BOE] [fear] [EOE] [EOS]	4.5	3.125	fear
R_3QLVVnAgRBRH41U_4	R_3QLVVnAgRBRH41U	307	i be an affirmed believer that your punishment should suit the crime, but the man be so old so i don't insure what the hold up make be for his sentence. i would interpret if he be wrongly convicted, but that serve not seem to be the case. the judicial system needs reformation because some of the things that are happen now be appalling.	1.0	4.0	3.0	20.0	24000.0	[BOS] I am an affirmed believer that your punishment should fit the crime, but the man is so old so I don't see what the hold up has been for his sentence. [BOE] [surprise] [EOE] [EOS] {sep_tok} [BOS] I would understand if he was wrongly convicted, but that does not seem to be the case. [BOE] [anger] [EOE] [EOS] {sep_tok} [BOS] The judicial system needs reformation because some of the things that are happening now are appalling. [BOE] [disgust] [EOE] [EOS]	2.0	2.0	anger
R_3QLVVnAgRBRH41U_5	R_3QLVVnAgRBRH41U	409	okay, i detest try about disease outbreaks. it have me so much stress because you make to fight something that you cannot see. and i be aware of all the medical advancements, but that only really apply me some piece of mind. it would nice to extinguish illness completely. survive in a utopian type society.	1.0	4.0	3.0	20.0	24000.0	[BOS] Okay, I hate hearing about disease outbreaks. [BOE] [anger] [EOE] [EOS] {sep_tok} [BOS] It causes me so much stress because you have to fight something that you cannot see. [BOE] [fear] [EOE] [EOS] {sep_tok} [BOS] And I am aware of all the medical advancements, but that only really gives me some piece of mind. [BOE] [surprise] [EOE] [EOS] {sep_tok} [BOS] It would nice to eradicate illness completely. [BOE] [neutral] [EOE] [EOS] {sep_tok} [BOS] Live in a utopian type society. [BOE] [neutral] [EOE] [EOS]	4.5	4.625	anger
R_YbsvqmtcaiZkmrf_1	R_YbsvqmtcaiZkmrf	53	i mat pretty neutral when i register the article. it didn't really disoblige me or sham me in any way emotionally or physically. i rule it really easy to couch out of my mind after register it as well. it be something that didn't have any feelings in me. i serve not feel positive nor negative after register the article.	1.0	4.0	1.0	29.0	80000.0	[BOS] I felt pretty neutral when i read the article. [BOE] [joy] [EOE] [EOS] {sep_tok} [BOS] It didn't really bother me or affect me in any way emotionally or physically. [BOE] [neutral] [EOE] [EOS] {sep_tok} [BOS] I found it really easy to put out of my mind after reading it as well. [BOE] [neutral] [EOE] [EOS] {sep_tok} [BOS] It was something that didn't induce any feelings in me. [BOE] [sadness] [EOE] [EOS] {sep_tok} [BOS] I did not feel positive nor negative after reading the article. [BOE] [anger] [EOE] [EOS]	1.0	1.0	neutral
R_YbsvqmtcaiZkmrf_2	R_YbsvqmtcaiZkmrf	112	my feelings after register the article exist that it build me feel a bit sad. i felt sad because i feel like the oil spills and leaks be operate to sham the wildlife especially the ones in the water. i am huge on avail animals and restrain them safe from humans harm them. this article definitely couch me more on the negative side.	1.0	4.0	1.0	29.0	80000.0	[BOS] My feelings after reading the article is that it made me feel a bit sad. [BOE] [sadness] [EOE] [EOS] {sep_tok} [BOS] I felt sad because i feel like the oil spills and leaks are going to affect the wildlife especially the ones in the water. [BOE] [sadness] [EOE] [EOS] {sep_tok} [BOS] I am huge on helping animals and keeping them safe from humans harming them. [BOE] [joy] [EOE] [EOS] {sep_tok} [BOS] This article definitely put me more on the negative side. [BOE] [anger] [EOE] [EOS]	3.667	2.25	sadness
R_YbsvqmtcaiZkmrf_3	R_YbsvqmtcaiZkmrf	170	my feelings towards this article be neutral as well. it coiffe not really urinate me experience anything. rather yet, it made me feel a bit bored and i kind of drowse off for a bit. i mat like it wasn't anything that would touch me or anything i would cogitate twice about. it urinate me feel mostly relaxed. i didn't make nay sort of positive or negative emotions towards the article.	1.0	4.0	1.0	29.0	80000.0	[BOS] My feelings towards this article is neutral as well. [BOE] [anger] [EOE] [EOS] {sep_tok} [BOS] It did not really make me feel anything. [BOE] [neutral] [EOE] [EOS] {sep_tok} [BOS] Rather yet, it made me feel a bit bored and i kind of dozed off for a bit. [BOE] [sadness] [EOE] [EOS] {sep_tok} [BOS] I felt like it wasn't anything that would impact me or anything i would think twice about. [BOE] [sadness] [EOE] [EOS] {sep_tok} [BOS] It made me feel mostly relaxed. [BOE] [joy] [EOE] [EOS] {sep_tok} [BOS] I didn't have nay sort of positive or negative emotions towards the article. [BOE] [anger] [EOE] [EOS]	1.0	1.0	sadness
R_YbsvqmtcaiZkmrf_4	R_YbsvqmtcaiZkmrf	263	after register the article, i be definitely a bit worried and alarmed. the main reason be because i am always very causitous when it descend to sickness and stuff like this. i feel like i really make to watch out for myself after register this article. other than that, i wasn't extremely terrorize from the article. i be just more alarmed i would say.	1.0	4.0	1.0	29.0	80000.0	[BOS] After reading the article, i was definitely a bit worried and alarmed. [BOE] [fear] [EOE] [EOS] {sep_tok} [BOS] The main reason is because i am always  very causitous when it comes to sickness and stuff like this. [BOE] [neutral] [EOE] [EOS] {sep_tok} [BOS] I feel like i really have to watch out for myself after reading this article. [BOE] [surprise] [EOE] [EOS] {sep_tok} [BOS] Other than that, i wasn't extremely terrified from the article. [BOE] [fear] [EOE] [EOS] {sep_tok} [BOS] I was just more alarmed i would say. [BOE] [fear] [EOE] [EOS]	1.0	1.5	fear
R_YbsvqmtcaiZkmrf_5	R_YbsvqmtcaiZkmrf	364	my feelings after register this article was that it apply me a somewhat negative feeling. i try to insure things from the immigrant's point of views. i try to insure how their families would be fork and how hard it would be to see one another. sometimes, they mightnot even be able to insure each other again. i mat a bit sad as well.	1.0	4.0	1.0	29.0	80000.0	[BOS] My feelings after reading this article was that it gave me a somewhat negative feeling. [BOE] [sadness] [EOE] [EOS] {sep_tok} [BOS] I tried to see things from the immigrant's point of views. [BOE] [neutral] [EOE] [EOS] {sep_tok} [BOS] I tried to see how their families would be separated and how hard it would be to see one another. [BOE] [surprise] [EOE] [EOS] {sep_tok} [BOS] Sometimes, they mightnot even be able to see each other again. [BOE] [neutral] [EOE] [EOS] {sep_tok} [BOS] I felt a bit sad as well. [BOE] [sadness] [EOE] [EOS]	2.333	1.0	sadness
R_dhyWmQDvtXTFHSp_1	R_dhyWmQDvtXTFHSp	18	there be a bad misunderstanding that conduce to the deaths of 3 people in jordan recently. they make be on high alert because of the isis attacks and when 3 americans operate close to the border they be blast and killed. it comprise sad to insure this happen to people when they be just try to coiffe their job it be very depressing.	1.0	6.0	1.0	32.0	51000.0	[BOS] There was a bad misunderstanding that lead to the deaths of 3 people in Jordan recently. [BOE] [surprise] [EOE] [EOS] {sep_tok} [BOS] They had been on high alert because of the ISIS attacks and when 3 Americans went close to the border they were shot and killed. [BOE] [neutral] [EOE] [EOS] {sep_tok} [BOS] It is sad to see this happen to people when they were just trying to do their job it is very depressing. [BOE] [sadness] [EOE] [EOS]	6.0	5.875	sadness
R_dhyWmQDvtXTFHSp_2	R_dhyWmQDvtXTFHSp	96	global warming be operate to be make an effect on the coffee trade. as global warming proceed to start worse there be operate to be less land that exist able to produce coffee. this be operate to exist bad for the many people who build their living produce coffee. it be estimated that 125 million people build their living this way. this be operate to be bad for these people who be already struggling.	1.0	6.0	1.0	32.0	51000.0	[BOS] Global warming is going to be having an effect on the coffee trade. [BOE] [neutral] [EOE] [EOS] {sep_tok} [BOS] As global warming continues to get worse there is going to be less land that is able to produce coffee. [BOE] [sadness] [EOE] [EOS] {sep_tok} [BOS] This is going to be bad for the many people who making their living producing coffee. [BOE] [sadness] [EOE] [EOS] {sep_tok} [BOS] It is estimated that 125 million people make their living this way. [BOE] [neutral] [EOE] [EOS] {sep_tok} [BOS] This is going to be bad for these people who are already struggling. [BOE] [sadness] [EOE] [EOS]	4.333	4.25	fear
R_dhyWmQDvtXTFHSp_3	R_dhyWmQDvtXTFHSp	210	the band that was diddle during the attack on the bataclan in france reelect there to observe the victims recently. it was very sad because it be such a large and brutal massacre. so many lives be misplace that day and for no reason what so ever. it be just very demoralise to cogitate about what those people must have operate through.	1.0	6.0	1.0	32.0	51000.0	[BOS] The band that was playing during the attack on the Bataclan in France returned there to honor the victims recently. [BOE] [neutral] [EOE] [EOS] {sep_tok} [BOS] It was very sad because it was such a large and brutal massacre. [BOE] [sadness] [EOE] [EOS] {sep_tok} [BOS] So many lives were lost that day and for no reason what so ever. [BOE] [sadness] [EOE] [EOS] {sep_tok} [BOS] It is just very depressing to think about what those people must have went through. [BOE] [sadness] [EOE] [EOS]	5.332999999999999	5.5	sadness
R_dhyWmQDvtXTFHSp_4	R_dhyWmQDvtXTFHSp	264	very depressing story i register about climate change. it exist start worse and we are operate to be experience warmer and warmer temperatures as the years operate on. the man build causes of global warming be not slacken down and it search like we will be plow with worse and worse weather as the years operate on. i vex about the future of this planet.	1.0	6.0	1.0	32.0	51000.0	[BOS] Very depressing story I read about climate change. [BOE] [sadness] [EOE] [EOS] {sep_tok} [BOS] It is getting worse and we are going to be experiencing warmer and warmer temperatures as the years go on. [BOE] [disgust] [EOE] [EOS] {sep_tok} [BOS] The man made causes of global warming are not slowing down and it looks like we will be dealing with worse and worse weather as the years go on. [BOE] [disgust] [EOE] [EOS] {sep_tok} [BOS] I worry about the future of this planet. [BOE] [fear] [EOE] [EOS]	3.5	6.875	sadness
R_dhyWmQDvtXTFHSp_5	R_dhyWmQDvtXTFHSp	381	wells fargo bosses be try to rook the system by unfold fake accounts. this be something that direct to a lot of people be thrust by their bosses to pack part in this scam. i register about one woman who misplace her job just because she be comply what her boss tell her to do. this poor woman be effectuate all because people need to be scammers.	1.0	6.0	1.0	32.0	51000.0	[BOS] Wells Fargo bosses were trying to scam the system by opening fake accounts. [BOE] [neutral] [EOE] [EOS] {sep_tok} [BOS] This is something that led to a lot of people being forced by their bosses to take part in this scam. [BOE] [neutral] [EOE] [EOS] {sep_tok} [BOS] I read about one woman who lost her job just because she was following what her boss told her to do. [BOE] [neutral] [EOE] [EOS] {sep_tok} [BOS] This poor woman was effected all because people wanted to be scammers. [BOE] [sadness] [EOE] [EOS]	4.833	4.25	anger
R_vlskxchAPeiideV_1	R_vlskxchAPeiideV	8	that was sad. i really felt for those dogs while i record that. it be especially sad for me becuase i feature make dogs myself my whole life. the kennel be iresponsible in its treatment of those dogs. those dogs merit justice and deserve to be process as if they be people. as many people find their dogs to be part of the family.	1.0	4.0	1.0	19.0	40000.0	[BOS] That was sad. [BOE] [sadness] [EOE] [EOS] {sep_tok} [BOS] I really felt for those dogs while I read that. [BOE] [sadness] [EOE] [EOS] {sep_tok} [BOS] It is especially sad for me becuase I have had dogs myself my whole life. [BOE] [sadness] [EOE] [EOS] {sep_tok} [BOS] The kennel was iresponsible in its treatment of those dogs. [BOE] [neutral] [EOE] [EOS] {sep_tok} [BOS] Those dogs deserve justice and deserve to be treated as if they were people. [BOE] [neutral] [EOE] [EOS] {sep_tok} [BOS] As many people find their dogs to be part of the family. [BOE] [neutral] [EOE] [EOS]	3.833	5.75	sadness
R_vlskxchAPeiideV_2	R_vlskxchAPeiideV	114	can you believe the canadian government serve something some terrible. i would never look canada to make something so bad on there record, especially apply there reputation. those families merit justice and any living relatives merit reparations from the government. this will at least be some justice.	1.0	4.0	1.0	19.0	40000.0	[BOS] Can you believe the Canadian government did something some terrible. [BOE] [surprise] [EOE] [EOS] {sep_tok} [BOS] I would never expect Canada to have something so bad on there record, especially given there reputation. [BOE] [sadness] [EOE] [EOS] {sep_tok} [BOS] Those families deserve justice and any living relatives deserve reparations from the government. [BOE] [neutral] [EOE] [EOS] {sep_tok} [BOS] This will at least be some justice. [BOE] [neutral] [EOE] [EOS]	4.167	6.375	disgust
R_vlskxchAPeiideV_3	R_vlskxchAPeiideV	206	what kirk pronounce be wrong and he should of apologized, which he did. this partially correct the situation but it still shine on him negatively. duckworth's patritism should not of be interrogate just because of her heritage. just because she be tai serve not mean she be less likely to be give to the country.	1.0	4.0	1.0	19.0	40000.0	[BOS] What Kirk said was wrong and he should of apologized, which he did. [BOE] [sadness] [EOE] [EOS] {sep_tok} [BOS] This partially rectifies the situation but it still reflects on him negatively. [BOE] [neutral] [EOE] [EOS] {sep_tok} [BOS] duckworth's patritism should not of been questioned just because of her heritage. [BOE] [neutral] [EOE] [EOS] {sep_tok} [BOS] Just because she is Tai does not mean she is less likely to be devoted to the country. [BOE] [neutral] [EOE] [EOS]	3.667	4.375	anger
R_vlskxchAPeiideV_4	R_vlskxchAPeiideV	322	trump's win be an upset but it should not of really been that uprising. some polling sites apply him a thirty percent chance of winning, and clinton be a historical unpopular candidate. the democracts should search within on lick there problems. they should sharpen on constitute a better candidate the next time around.	1.0	4.0	1.0	19.0	40000.0	[BOS] Trump's win was an upset but it should not of really been that uprising. [BOE] [surprise] [EOE] [EOS] {sep_tok} [BOS] Some polling sites gave him a thirty percent chance of winning, and Clinton was a historical unpopular candidate. [BOE] [neutral] [EOE] [EOS] {sep_tok} [BOS] The democracts should look within on solving there problems. [BOE] [neutral] [EOE] [EOS] {sep_tok} [BOS] they should focus on nominating a better candidate the next time around. [BOE] [neutral] [EOE] [EOS]	3.667	4.125	neutral
R_vlskxchAPeiideV_5	R_vlskxchAPeiideV	385	trump definitely make a republican view in climate change. he is more extreme then most in that he hint human's may not be responsible at all for climate change. it be clear that humans be at least somewhat responsible, but scientists discord just to what extent humans be responsible for the changing climate	1.0	4.0	1.0	19.0	40000.0	[BOS] Trump definitely has a republican view in climate change. [BOE] [neutral] [EOE] [EOS] {sep_tok} [BOS] He is more extreme then most in that he suggests human's may not be responsible at all for climate change. [BOE] [neutral] [EOE] [EOS] {sep_tok} [BOS] It is clear that humans are at least somewhat responsible, but scientists disagree just to what extent humans are responsible for the changing climate [BOE] [neutral] [EOE] [EOS]	3.5	3.875	neutral
R_2e8M8KMUCf35x8Q_1	R_2e8M8KMUCf35x8Q	47	i can't even imagine half the stuff that the people of aleppo be operate though. it must be some kind of nightmare to start a text that your city be operate to be bombed. i'm really thankful that you conjoin the reserves and not something that'd get you deployed. i'm grateful that i make you and a much more stable country.	1.0	6.0	1.0	28.0	11000.0	[BOS] I can't even imagine half the stuff that the people of Aleppo are going though. [BOE] [sadness] [EOE] [EOS] {sep_tok} [BOS] It must be some kind of nightmare to get a text that your city is going to be bombed. [BOE] [fear] [EOE] [EOS] {sep_tok} [BOS] I'm really thankful that you joined the reserves and not something that'd get you deployed. [BOE] [joy] [EOE] [EOS] {sep_tok} [BOS] I'm grateful that I have you and a much more stable country. [BOE] [joy] [EOE] [EOS]	5.167000000000001	5.875	fear
R_2e8M8KMUCf35x8Q_2	R_2e8M8KMUCf35x8Q	97	hey here's a list of some things you might want to search into before you couch them into your body, i don't bed how trustworthy the source comprise but better safe than sorry right? last thing we need exist something bad to happen to one of us. i bed you're on a bit of a health kick so i make no idea what you've be up to on that front, just let you bed i care though.	1.0	6.0	1.0	28.0	11000.0	[BOS] Hey here's a list of some things you might want to look into before you put them into your body, I don't know how trustworthy the source is but better safe than sorry right? [BOE] [surprise] [EOE] [EOS] {sep_tok} [BOS] Last thing we want is something bad to happen to one of us. [BOE] [neutral] [EOE] [EOS] {sep_tok} [BOS] I know you're on a bit of a health kick so I have no idea what you've been up to on that front, just letting you know I care though. [BOE] [joy] [EOE] [EOS]	1.0	1.375	fear
R_2e8M8KMUCf35x8Q_3	R_2e8M8KMUCf35x8Q	243	here's a story on the crazies from up in oregon that start off way too lightly. just a symptom of the larger issues this country be make with far right extremists pack advantage of a system that need to avail them at the expense of the rest of the nation. honestly oregon make be search pretty darn bad recently	1.0	6.0	1.0	28.0	11000.0	[BOS] Here's a story on the crazies from up in Oregon that got off way too lightly. [BOE] [neutral] [EOE] [EOS] {sep_tok} [BOS] Just a symptom of the larger issues this country is having with far right extremists taking advantage of a system that wants to help them at the expense of the rest of the nation. [BOE] [neutral] [EOE] [EOS] {sep_tok} [BOS] Honestly Oregon has been looking pretty darn bad recently [BOE] [sadness] [EOE] [EOS]	1.0	1.0	sadness
R_2e8M8KMUCf35x8Q_4	R_2e8M8KMUCf35x8Q	290	lucky we don't last to the beach much eh? but really it's kinda spooky that these things be increasing. probably something to coiffe with global warming in a way we don't understand yet. i'm already afraid enough of open water, don't want to be cogitate about sharks even closer to land. i bed it's australia, but florida isn't that much different.	1.0	6.0	1.0	28.0	11000.0	[BOS] Lucky we don't go to the beach much eh? [BOE] [surprise] [EOE] [EOS] {sep_tok} [BOS] But really it's kinda spooky that these things are increasing. [BOE] [fear] [EOE] [EOS] {sep_tok} [BOS] Probably something to do with global warming in a way we don't understand yet. [BOE] [surprise] [EOE] [EOS] {sep_tok} [BOS] I'm already afraid enough of open water, don't need to be thinking about sharks even closer to land. [BOE] [fear] [EOE] [EOS] {sep_tok} [BOS] I know it's Australia, but Florida isn't that much different. [BOE] [neutral] [EOE] [EOS]	3.167	1.0	fear
R_2e8M8KMUCf35x8Q_5	R_2e8M8KMUCf35x8Q	342	yeah russia make some real distinct issues for the underclasses which be super ironic apply it's history. the oligarchy in place need people to have just enough to survive and not complain, because they bed the russian people can be impart to carry against a mighty nation. it's happen twice so far.	1.0	6.0	1.0	28.0	11000.0	[BOS] Yeah Russia has some real distinct issues for the underclasses which is super ironic given it's history. [BOE] [neutral] [EOE] [EOS] {sep_tok} [BOS] The oligarchy in place wants people to have just enough to survive and not complain, because they know the Russian people can be brought to bear against a mighty nation. [BOE] [neutral] [EOE] [EOS] {sep_tok} [BOS] It's happened twice so far. [BOE] [neutral] [EOE] [EOS]	3.667	2.25	neutral
R_2CKuUANCcIJpwIr_1	R_2CKuUANCcIJpwIr	9	it's utter devastation in new zealand after hurt one of the worst earthquakes in 2011 the south island be biff with another two earthquakes and it's aftershocks could be mat throughout the whole island. the area be completely waste and search like a ghost town because of all the damage and danger from the downed power lines.	1.0	5.0	2.0	30.0	75000.0	[BOS] It's utter devastation in New Zealand after suffering one of the worst earthquakes in 2011 the South Island was pummeled with another two earthquakes and it's aftershocks could be felt throughout the whole island. [BOE] [fear] [EOE] [EOS] {sep_tok} [BOS] The area is completely devastated and looks like a ghost town because of all the damage and danger from the downed power lines. [BOE] [sadness] [EOE] [EOS]	2.667	2.25	sadness
R_2CKuUANCcIJpwIr_2	R_2CKuUANCcIJpwIr	105	it sicken me that more of these third world countries be experience the aid they merit so that the kids can be healed and give and not hurt the diseases that be out there this time it is measles that be down children in northern sudan. it build me sad that this be just an everyday thing to this country and if nobody be assist then more and more children will exit because people don't worry about them.	1.0	5.0	2.0	30.0	75000.0	[BOS] It sickens me that more of these third world countries are receiving the aid they deserve so that the kids can be healed and fed and not suffer the diseases that are out there this time it is measles that is killing children in northern Sudan. [BOE] [sadness] [EOE] [EOS] {sep_tok} [BOS] It makes me sad that this is just an everyday thing to this country and if nobody is helping then more and more children will die because people don't care about them. [BOE] [sadness] [EOE] [EOS]	1.6669999999999998	1.625	sadness
