message_id	response_id	article_id	essay	gender	education	race	age	income	raw_input_emotions	empathy	distress	emotion
R_2fea3z0hayINIjT_1	R_2fea3z0hayINIjT	3	iodin can't imagine what those girl are going through. one day you're enjoying a playfulness kinsfolk outing and suddenly everyone one is killed in a tragic accident. mass are supposed to be safe in plaza like that. it's impossible to think that your entire biography can be destroyed in a berth like that. accident like this should never happen, as the customers are trusting their family's safe to the park.	1.0	6.0	1.0	45.0	79000.0	[BOS] I can't imagine what those girls are going through. [BOE] [surprise] [EOE] [EOS] {sep_tok} [BOS]  One day you're enjoying a fun family outing and suddenly everyone one is killed in a tragic accident. [BOE] [sadness] [EOE] [EOS] {sep_tok} [BOS]  People are supposed to be safe in places like that. [BOE] [neutral] [EOE] [EOS] {sep_tok} [BOS]  It's impossible to think that your entire life can be destroyed in a situation like that. [BOE] [sadness] [EOE] [EOS] {sep_tok} [BOS]   Accidents like this should never happen, as the customers are trusting their family's safety to the park. [BOE] [neutral] [EOE] [EOS]	3.833	3.0	sadness
R_2fea3z0hayINIjT_2	R_2fea3z0hayINIjT	136	the ingroup needed to be dismantled as you can't have colonization within a modern country. iodin know it can be perceived as heartless, but it is for the greater good of the community. colonization such as these offer no aegis or base to it's occupants. the berth becomes unsafe for both the resident as well as the surrounding community.	1.0	6.0	1.0	45.0	79000.0	[BOS] The camp needed to be dismantled as you can't have settlements within a modern country. [BOE] [neutral] [EOE] [EOS] {sep_tok} [BOS]  I know it can be perceived as heartless, but it is for the greater good of the community. [BOE] [neutral] [EOE] [EOS] {sep_tok} [BOS]  Settlements such as these offer no protection or infrastructure to it's occupants. [BOE] [neutral] [EOE] [EOS] {sep_tok} [BOS]  The situation becomes unsafe for both the residents as well as the surrounding community. [BOE] [fear] [EOE] [EOS]	2.167	1.375	neutral
R_2fea3z0hayINIjT_3	R_2fea3z0hayINIjT	193	the whole berth has enough inculpation to go around for both parties. the dupe should not have fallen overboard, however, the sail ship is ultimately responsible for the safe of it's passengers. whether or not the victim was being confronted by the ship's certificate makes no difference as to whether they should have ordered a lookup for the fallen passenger.	1.0	6.0	1.0	45.0	79000.0	[BOS] The wholes situation has enough blame to go around for both parties. [BOE] [neutral] [EOE] [EOS] {sep_tok} [BOS]  The victim should not have fallen overboard, however, the cruise ship is ultimately responsible for the safety of it's passengers. [BOE] [neutral] [EOE] [EOS] {sep_tok} [BOS]  Whether or not the victim was being confronted by the ship's security makes no difference as to whether they should have ordered a search for the fallen passenger. [BOE] [neutral] [EOE] [EOS]	1.5	1.5	anger
R_2fea3z0hayINIjT_4	R_2fea3z0hayINIjT	312	this is unfortunately the effect of fight within this constituent of the world. certain country are not interested in the peacefulness summons and will deliberatley sabotage any effort. the convey was most likely not escorted by terrorists, however, it is a common claim made by aggressive country under these circumstances.	1.0	6.0	1.0	45.0	79000.0	[BOS] This is unfortunately the consequence of conflicts within this part of the world. [BOE] [sadness] [EOE] [EOS] {sep_tok} [BOS]  Certain countries are not interested in the peace process and will deliberatley sabotage any effort. [BOE] [neutral] [EOE] [EOS] {sep_tok} [BOS]  The convey was most likely not escorted by terrorists, however, it is a common claim made by aggressive nations under these circumstances. [BOE] [neutral] [EOE] [EOS]	1.167	2.5	neutral
R_2fea3z0hayINIjT_5	R_2fea3z0hayINIjT	348	"this is a typical ""sour grapes"" approach to anything regarding the trumpet presidency. liberals feel that his mere existence will somehow ruin mankind. this feeler to constantly blaming all of the country's job on him only further damage to futurity of the country. acting like the previous chairman was some apotheosis is nothing more than revisionist account manner of thinking."	1.0	6.0	1.0	45.0	79000.0	"[BOS] This is a typical ""sour grapes"" approach to anything regarding the Trump presidency. [BOE] [neutral] [EOE] [EOS] {sep_tok} [BOS]  Liberals feel that his mere existence will somehow ruin mankind. [BOE] [neutral] [EOE] [EOS] {sep_tok} [BOS]  This approach to constantly blaming all of the country's problems on him only further harms to future of the country. [BOE] [neutral] [EOE] [EOS] {sep_tok} [BOS]  Acting like the previous president was some ideal is nothing more than revisionist history way of thinking. [BOE] [neutral] [EOE] [EOS]"	1.0	2.375	neutral
R_1ml1pyosfEpZIOZ_1	R_1ml1pyosfEpZIOZ	10	reading the news reminds me of the forfeit made by serviceman and woman of the police departments, the bull left his folk that daylight for workplace like any other day and he was gunned down for doing his job, it makes me reflect on the throttle pentateuch of this country. do we really need to make amendment to curtail this bar of violent crimes?	1.0	6.0	1.0	29.0	40000.0	[BOS] Reading the news reminds me of the sacrifices made by men and women of the police departments, the cop left his family that day for work like any other day and he was gunned down for doing his job, it makes me reflect on the gun laws of this country. [BOE] [sadness] [EOE] [EOS] {sep_tok} [BOS] Do we really need to make amendments to curtail this streak of violent crimes? [BOE] [surprise] [EOE] [EOS]	3.167	4.125	sadness
R_1ml1pyosfEpZIOZ_2	R_1ml1pyosfEpZIOZ	94	these mindless kill for misguided opinion is really getting out of hands, someone's husband, father, mother, wife , son, girl murdered violently in the streets makes you lose faith in humanity. are we really beyond redemption? personally i feel isi especially is growing more fearless by the day. the creation needs to do something	1.0	6.0	1.0	29.0	40000.0	[BOS] These mindless killings for misguided beliefs is really getting out of hands, someone's husband, father, mother, wife , son, daughter murdered violently in the streets makes you lose faith in humanity. [BOE] [sadness] [EOE] [EOS] {sep_tok} [BOS] Are we really beyond redemption? [BOE] [surprise] [EOE] [EOS] {sep_tok} [BOS] Personally I feel ISIS especially is growing more fearless by the day. [BOE] [joy] [EOE] [EOS] {sep_tok} [BOS] The world needs to do something [BOE] [neutral] [EOE] [EOS]	3.833	4.375	anger
R_1ml1pyosfEpZIOZ_3	R_1ml1pyosfEpZIOZ	240	a whooping 2600 pregnant woman testing positive to this virus in the usa and neighboring province is alarming, i wager everyone reading this especially pregnant woman would be scared of giving birthing to nestling with microcephalus as if they don't have enough to worry about before. iodin think no quantity is too much to tackle this	1.0	6.0	1.0	29.0	40000.0	[BOS] A whooping 2600 pregnant women testing positive to this virus in the USA and neighboring states is alarming, I bet everyone reading this especially pregnant women would be scared of giving birth  to children with microcephaly  as if they don't have enough to worry about before. [BOE] [fear] [EOE] [EOS] {sep_tok} [BOS] I think no amount is too much to tackle this [BOE] [neutral] [EOE] [EOS]	3.167	4.0	fear
R_1ml1pyosfEpZIOZ_4	R_1ml1pyosfEpZIOZ	278	i think masses would have a plain day over this in blog and forums, especially the confederacy theorizer who thinks some cabal is somewhere controlling effect and outcomes, the good word is the cowcatcher survived and was recovered safely and maybe russia should be more focused on ensuring safe of its military .	1.0	6.0	1.0	29.0	40000.0	[BOS] I think people would have a field day over this in blogs and forums, especially the conspiracy theorist who thinks some cabal is somewhere controlling events and outcomes,  the good news is the pilot survived and was recovered safely and maybe Russia should be more focused on ensuring safety of its military . [BOE] [neutral] [EOE] [EOS]	4.333	5.5	anger
R_1ml1pyosfEpZIOZ_5	R_1ml1pyosfEpZIOZ	337	its heart wrenching to read level and see movie of nestling forced into labor. i personally feel that is the summit of cruelty. turkey is particularly notorious for child trafficking and labor, its alarming the governing is not doing anything about this problem. nestling should be put in schooltime not some factory!	1.0	6.0	1.0	29.0	40000.0	[BOS] Its heart wrenching to read stories and see pictures of kids forced into labor. [BOE] [sadness] [EOE] [EOS] {sep_tok} [BOS] I personally feel that is the height of cruelty. [BOE] [anger] [EOE] [EOS] {sep_tok} [BOS] Turkey is  particularly notorious for child trafficking and labor, its alarming the government is not doing anything about this problem. [BOE] [fear] [EOE] [EOS] {sep_tok} [BOS] Children should be put in school not some factory! [BOE] [neutral] [EOE] [EOS]	4.0	3.75	sadness
R_1C0Z9McLLQtjIo9_1	R_1C0Z9McLLQtjIo9	12	gosh there has been a motorcoach crash, pretty sad. apparently a spate of masses were hurt. i feel so bad for their ally and kinsfolk members, like they aren't even knowing if they are okay or what is going on. really sad situation. iodin guess more entropy will be forthcoming because riht now they didn't have all the detail yet.	2.0	7.0	1.0	38.0	42000.0	[BOS] Gosh there has been a bus crash, pretty sad. [BOE] [sadness] [EOE] [EOS] {sep_tok} [BOS]  Apparently a lot of people were hurt. [BOE] [sadness] [EOE] [EOS] {sep_tok} [BOS]  I feel so bad for their friends and family members, like they aren't even knowing if they are okay or what is going on. [BOE] [sadness] [EOE] [EOS] {sep_tok} [BOS]  Really sad situation. [BOE] [sadness] [EOE] [EOS] {sep_tok} [BOS]  I guess more information will be forthcoming because riht now they didn't have all the details yet. [BOE] [neutral] [EOE] [EOS]	2.167	2.0	sadness
R_1C0Z9McLLQtjIo9_2	R_1C0Z9McLLQtjIo9	87	omg did you realize that banana could become extinct? this is so devastating to me because they are one of the only yield i even like, plus my nestling love them. we need to do everything we can to prevent this from happening~! banana absolutely must be saved. i think this would be a serious issue if this were to actuallyh appen.	2.0	7.0	1.0	38.0	42000.0	[BOS] OMG did you realize that bananas could become extinct? [BOE] [surprise] [EOE] [EOS] {sep_tok} [BOS]  This is so devastating to me because they are one of the only fruits I even like, plus my kids love them. [BOE] [joy] [EOE] [EOS] {sep_tok} [BOS]  We need to do everything we can to prevent this from happening~! [BOE] [neutral] [EOE] [EOS] {sep_tok} [BOS]  Bananas absolutely must be saved. [BOE] [neutral] [EOE] [EOS] {sep_tok} [BOS]  I think this would be a serious issue if this were to actuallyh appen. [BOE] [neutral] [EOE] [EOS]	1.0	1.625	sadness
R_1C0Z9McLLQtjIo9_3	R_1C0Z9McLLQtjIo9	252	so apparently poland is exhuming consistency from a planer wreck almost ten years ago that they think might have involved some foul play. i mean i guessing you gotta get to the truth but i find it weird when masses start digging up soundbox and not to mention it's also a little disrespectful to the dead who have no say in the matter.	2.0	7.0	1.0	38.0	42000.0	[BOS] So apparently Poland is exhuming bodies from a plane crash almost ten years ago that they think might have involved some foul play. [BOE] [neutral] [EOE] [EOS] {sep_tok} [BOS]  I mean I guess you gotta get to the truth but I Find it weird when people start digging up bodies and not to mention it's also a little disrespectful to the dead who have no say in the matter. [BOE] [anger] [EOE] [EOS]	1.0	1.0	anger
R_1C0Z9McLLQtjIo9_4	R_1C0Z9McLLQtjIo9	320	another onset on a mall - while no i was actually hurt, this is just an ongoing trend that concerns me so much. it's gottten to where i feel like nowhere we go is safe anymore. i don't like going to crowded plaza anymore or anywhere that there are a lot of people. it seems like it's more likely to happen there plus it's always some crazy immigrant.	2.0	7.0	1.0	38.0	42000.0	[BOS] Another attack on a mall - while no one was actually hurt, this is just an ongoing trend that concerns me so much. [BOE] [fear] [EOE] [EOS] {sep_tok} [BOS]  It's gottten to where I Feel like nowhere we go is safe anymore. [BOE] [neutral] [EOE] [EOS] {sep_tok} [BOS]  I don't like going to crowded places anymore or anywhere that there are a lot of people. [BOE] [anger] [EOE] [EOS] {sep_tok} [BOS]  It seems like it's more likely to happen there plus it's always some crazy immigrant. [BOE] [neutral] [EOE] [EOS]	1.833	3.0	fear
R_1C0Z9McLLQtjIo9_5	R_1C0Z9McLLQtjIo9	356	iodin can't stand protesters! i'm so sick of people acting like this is an appropriate manner to voice their opinions. acting like fauna destroying things, it just sickens me really. what happened to masses acting mature and responsible in life? jesus christ, going out looting affair and destroying. what is wrong with people.	2.0	7.0	1.0	38.0	42000.0	[BOS] I can't stand protesters! [BOE] [anger] [EOE] [EOS] {sep_tok} [BOS]  I'm so sick of people acting like this is an appropriate way to voice their opinions. [BOE] [anger] [EOE] [EOS] {sep_tok} [BOS]  Acting like animals destroying things, it just sickens me really. [BOE] [disgust] [EOE] [EOS] {sep_tok} [BOS]  What happened to people acting mature and responsible in life? [BOE] [surprise] [EOE] [EOS] {sep_tok} [BOS]  Jesus Christ, going out looting things and destroying. [BOE] [neutral] [EOE] [EOS] {sep_tok} [BOS]  What is wrong with people. [BOE] [surprise] [EOE] [EOS]	1.0	1.5	anger
R_1N7VCOKiQFNiHeO_1	R_1N7VCOKiQFNiHeO	39	world think they control the creation and everything in it. this wolf broke away from its pack searching for a teammate and intended no harm, but yet, humans, empowered sniper to be exact, quickly put an ending to the biography of a keep being -- for what? it's a pity to see that world do not respect the biography of anything else on this planet.	1.0	5.0	1.0	31.0	80000.0	[BOS] Humans think they control the world and everything in it. [BOE] [neutral] [EOE] [EOS] {sep_tok} [BOS] This wolf broke away from its pack searching for a mate and intended no harm, but yet, humans, empowered snipers to be exact, quickly put an end to the life of a living being -- for what? [BOE] [neutral] [EOE] [EOS] {sep_tok} [BOS] It's a shame to see that humans do not respect the lives of anything else on this planet. [BOE] [sadness] [EOE] [EOS]	6.332999999999999	5.125	disgust
R_1N7VCOKiQFNiHeO_2	R_1N7VCOKiQFNiHeO	167	i'm glad these orangutan were rescued, despite the setting that led them there. they are sentient beingness and should be treated as we humans treat each other - with care. hopefully dina will be treated and able to live a full biography along with the others she was rescued with. we as humans need to show more pity to all living affair in this world.	1.0	5.0	1.0	31.0	80000.0	[BOS] I'm glad these orangutans were rescued, despite the circumstance that led them there. [BOE] [joy] [EOE] [EOS] {sep_tok} [BOS] They are sentient beings and should be treated as we humans treat each other - with care. [BOE] [neutral] [EOE] [EOS] {sep_tok} [BOS] Hopefully Dina will be treated and able to live a full life along with the others she was rescued with. [BOE] [joy] [EOE] [EOS] {sep_tok} [BOS] We as humans need to show more compassion to all living things in this world. [BOE] [neutral] [EOE] [EOS]	6.0	3.5	joy
R_1N7VCOKiQFNiHeO_3	R_1N7VCOKiQFNiHeO	172	its a pity to see the value these terrorist put on other human lives. torturing and executing members of police forcefulness or member of the community for what? because their opinion don't align? to say these people, after being brutally murdered do not deserve a proper sepulture (at the very least) is just absurd.	1.0	5.0	1.0	31.0	80000.0	[BOS] Its a shame to see the value these terrorists put on other human lives. [BOE] [sadness] [EOE] [EOS] {sep_tok} [BOS] Torturing and executing members of police force or members of the community for what? [BOE] [neutral] [EOE] [EOS] {sep_tok} [BOS] Because their beliefs don't align? [BOE] [neutral] [EOE] [EOS] {sep_tok} [BOS] To say these people, after being brutally murdered do not deserve a proper burial (at the very least) is just absurd. [BOE] [anger] [EOE] [EOS]	4.333	5.75	sadness
R_1N7VCOKiQFNiHeO_4	R_1N7VCOKiQFNiHeO	273	"its amazing what our country does sometimes. we steal country from the native over c of days and their qualification get smaller and smaller as we want to industrialize every scrap of america. its silly to think that masses that once lived on these country have to live on ""reservations"" to begin with. what gives our politics the rightfield to completely control every scrap of country and mortal that exists on it (before or after they were here?)"	1.0	5.0	1.0	31.0	80000.0	"[BOS] Its amazing what our country does sometimes. [BOE] [joy] [EOE] [EOS] {sep_tok} [BOS] We steal land from the natives over hundreds of years and their reservations get smaller and smaller as we want to industrialize every bit of America. [BOE] [neutral] [EOE] [EOS] {sep_tok} [BOS] Its silly to think that people that once lived on these lands have to live on ""reservations"" to begin with. [BOE] [anger] [EOE] [EOS] {sep_tok} [BOS] What gives our government the right to completely control every bit of land and person that exists on it (before or after they were here?) [BOE] [surprise] [EOE] [EOS]"	4.833	5.0	joy
R_1N7VCOKiQFNiHeO_5	R_1N7VCOKiQFNiHeO	396	looney to believe that these affair are happening - naturally. is it because of global warming? are there are party at romp here? i don't want to sound like a confederacy theorist, but what is the suit of all of these wild fires? what else can we do to prevent them? we need to protect nature and preserve whats left - everyone should do their part.	1.0	5.0	1.0	31.0	80000.0	[BOS] Crazy to believe that these things are happening - naturally. [BOE] [surprise] [EOE] [EOS] {sep_tok} [BOS] Is it because of global warming? [BOE] [surprise] [EOE] [EOS] {sep_tok} [BOS] Are there are parties at play here? [BOE] [surprise] [EOE] [EOS] {sep_tok} [BOS] I don't want to sound like a conspiracy theorist, but what is the cause of all of these wild fires? [BOE] [surprise] [EOE] [EOS] {sep_tok} [BOS] What else can we do to prevent them? [BOE] [surprise] [EOE] [EOS] {sep_tok} [BOS] We need to protect nature and preserve whats left - everyone should do their part. [BOE] [neutral] [EOE] [EOS]	4.0	4.0	surprise
R_1ozjteCWKLw5htX_1	R_1ozjteCWKLw5htX	45	this article has made my gist so heavy. iodin had to pause a duo multiplication while reading, just to gather my sentiment so that iodin could continue. i feel for the innocent masses who should not have been involved in this at all. iodin wish that we could do something to help these masses come to an correspondence so this terrible conflict can end. i can't even begin to imagine what it must feel like to live in a plaza where you have to have such strong fear to even leave your home. i can't imagine living amongst such emphasis and turmoil. my gist is so heavy and i wish there was something i could do to help.	2.0	2.0	1.0	23.0	34000.0	[BOS] This article has made my heart so heavy. [BOE] [sadness] [EOE] [EOS] {sep_tok} [BOS] I had to pause a couple times while reading, just to gather my thoughts so that I could continue. [BOE] [neutral] [EOE] [EOS] {sep_tok} [BOS] I feel for the innocent people who should not have been involved in this at all. [BOE] [sadness] [EOE] [EOS] {sep_tok} [BOS] I wish that we could do something to help these people come to an agreement so this terrible conflict can end. [BOE] [joy] [EOE] [EOS] {sep_tok} [BOS] I can't even begin to imagine what it must feel like to live in a place where you have to have such strong fear to even leave your home. [BOE] [fear] [EOE] [EOS] {sep_tok} [BOS] I can't imagine living amongst such stress and turmoil. [BOE] [surprise] [EOE] [EOS] {sep_tok} [BOS] My heart is so heavy and I wish there was something I could do to help. [BOE] [joy] [EOE] [EOS]	7.0	7.0	sadness
R_1ozjteCWKLw5htX_2	R_1ozjteCWKLw5htX	138	iodin was bullied in school, which led to self harm, and eventually a self-destruction attempt. this article reminded me so much of myself, and iodin want to do something to put a stop this bullying. as i sit here with weeping welling my eyes, now a mother, iodin can't imagine being in the shoes of these parent who lost their children all because other nestling just can't be nice. i am so sad for these nestling who saw no other manner out of this mess than to just end their lives. their pain is felt deeply in my soul, and my compliments is that somehow, someday, no i else will feel that form of pain.	2.0	2.0	1.0	23.0	34000.0	[BOS] I was bullied in school, which led to self harm, and eventually a suicide attempt. [BOE] [sadness] [EOE] [EOS] {sep_tok} [BOS] This article reminded me so much of myself, and I want to do something to put a stop this bullying. [BOE] [joy] [EOE] [EOS] {sep_tok} [BOS] As I sit here with tears welling my eyes, now a mother, I can't imagine being in the shoes of these parents who lost their children all because other kids just can't be nice. [BOE] [sadness] [EOE] [EOS] {sep_tok} [BOS] I am so sad for these kids who saw no other way out of this mess than to just end their lives. [BOE] [sadness] [EOE] [EOS] {sep_tok} [BOS] Their pain is felt deeply in my soul, and my wish is that somehow, someday, no one else will feel that kind of pain. [BOE] [joy] [EOE] [EOS]	7.0	7.0	sadness
R_1ozjteCWKLw5htX_3	R_1ozjteCWKLw5htX	248	iodin know that not everyone agrees with trumpet becoming president, and i will admit that i'm not certain of the path this commonwealth is going to take, but there were many many many masses that did not approve of obama becoming president, yet we all survived that, as we will this. as a woman, and one who is married to a biracial man and has a biracial son, iodin will say, iodin do not fear my exsitance or my families. even if trumpet is not the most respectful, he is not out to get women, masses of color, etc. he is trying to do what is best for this country, and he was voted in, so we need to just get on with our biography and hope for the best.	2.0	2.0	1.0	23.0	34000.0	[BOS] I know that not everyone agrees with Trump becoming president, and I will admit that I'm not certain of the path this country is going to take, but there were many many many people that did not approve of Obama becoming president, yet we all survived that, as we will this. [BOE] [neutral] [EOE] [EOS] {sep_tok} [BOS] As a woman, and one who is married to a biracial man and has a biracial son, I will say, I do not fear my exsitance or my families. [BOE] [neutral] [EOE] [EOS] {sep_tok} [BOS] Even if trump is not the most respectful, he is not out to get women, people of color, etc. [BOE] [neutral] [EOE] [EOS] {sep_tok} [BOS] He is trying to do what is best for this country, and he was voted in, so we need to just get on with our lives and hope for the best. [BOE] [joy] [EOE] [EOS]	1.5	1.125	neutral
R_1ozjteCWKLw5htX_4	R_1ozjteCWKLw5htX	323	iodin do think that this male birthing control for serviceman should be a thing. serviceman should be able to decide if those hazard are worth the protection. serviceman should have the ability to take birthing control in their own hands, as they never know if a woman is lieing about taking her's or if they have been taking it properly. an added aegis could never hurt for both parties. i, however, do not feel very sympathetic. i think woman are always looking for things to complain about, and this is just another thing. women, get over it. if your slope effect from your birthing control are too strong, then just don't have sex.	2.0	2.0	1.0	23.0	34000.0	[BOS] I do think that this male birth control for men should be a thing. [BOE] [neutral] [EOE] [EOS] {sep_tok} [BOS] Men should be able to decide if those risks are worth the protection. [BOE] [neutral] [EOE] [EOS] {sep_tok} [BOS] Men should have the ability to take birth control in their own hands, as they never know if a woman is lieing about taking her's or if they have been taking it properly. [BOE] [neutral] [EOE] [EOS] {sep_tok} [BOS] An added protection could never hurt for both parties. [BOE] [neutral] [EOE] [EOS] {sep_tok} [BOS] I, however, do not feel very sympathetic. [BOE] [anger] [EOE] [EOS] {sep_tok} [BOS] I think women are always looking for things to complain about, and this is just another thing. [BOE] [neutral] [EOE] [EOS] {sep_tok} [BOS] Women, get over it. [BOE] [joy] [EOE] [EOS] {sep_tok} [BOS] If your side effects from your birth control are too strong, then just don't have sex. [BOE] [neutral] [EOE] [EOS]	2.0	1.0	anger
