message_id	response_id	article_id	essay	gender	education	race	age	income	raw_input_emotions	empathy	distress	emotion
R_2fea3z0hayINIjT_1	R_2fea3z0hayINIjT	3	i can't guess what those girls be operate through. one day you're delight a fun family outing and suddenly everyone one comprise down in a tragic accident. people be presuppose to be safe in places like that. it's impossible to cogitate that your entire life can exist ruin in a situation like that. accidents like this should never happen, as the customers are swear their family's safety to the park.	1.0	6.0	1.0	45.0	79000.0	[BOS] I can't imagine what those girls are going through. [BOE] [surprise] [EOE] [EOS] {sep_tok} [BOS]  One day you're enjoying a fun family outing and suddenly everyone one is killed in a tragic accident. [BOE] [sadness] [EOE] [EOS] {sep_tok} [BOS]  People are supposed to be safe in places like that. [BOE] [neutral] [EOE] [EOS] {sep_tok} [BOS]  It's impossible to think that your entire life can be destroyed in a situation like that. [BOE] [sadness] [EOE] [EOS] {sep_tok} [BOS]   Accidents like this should never happen, as the customers are trusting their family's safety to the park. [BOE] [neutral] [EOE] [EOS]	3.833	3.0	sadness
R_2fea3z0hayINIjT_2	R_2fea3z0hayINIjT	136	the camp want to be level as you can't have settlements within a modern country. i bed it can be comprehend as heartless, but it be for the greater good of the community. settlements such as these bid no protection or infrastructure to it's occupants. the situation suit unsafe for both the residents as well as the ring community.	1.0	6.0	1.0	45.0	79000.0	[BOS] The camp needed to be dismantled as you can't have settlements within a modern country. [BOE] [neutral] [EOE] [EOS] {sep_tok} [BOS]  I know it can be perceived as heartless, but it is for the greater good of the community. [BOE] [neutral] [EOE] [EOS] {sep_tok} [BOS]  Settlements such as these offer no protection or infrastructure to it's occupants. [BOE] [neutral] [EOE] [EOS] {sep_tok} [BOS]  The situation becomes unsafe for both the residents as well as the surrounding community. [BOE] [fear] [EOE] [EOS]	2.167	1.375	neutral
R_2fea3z0hayINIjT_3	R_2fea3z0hayINIjT	193	the wholes situation make enough blame to go around for both parties. the victim should not make shine overboard, however, the cruise ship be ultimately responsible for the safety of it's passengers. whether or not the victim exist be confront by the ship's security build no difference as to whether they should make consecrate a search for the shine passenger.	1.0	6.0	1.0	45.0	79000.0	[BOS] The wholes situation has enough blame to go around for both parties. [BOE] [neutral] [EOE] [EOS] {sep_tok} [BOS]  The victim should not have fallen overboard, however, the cruise ship is ultimately responsible for the safety of it's passengers. [BOE] [neutral] [EOE] [EOS] {sep_tok} [BOS]  Whether or not the victim was being confronted by the ship's security makes no difference as to whether they should have ordered a search for the fallen passenger. [BOE] [neutral] [EOE] [EOS]	1.5	1.5	anger
R_2fea3z0hayINIjT_4	R_2fea3z0hayINIjT	312	this be unfortunately the consequence of conflicts within this part of the world. certain countries be not interested in the peace process and will deliberatley weaken any effort. the convey be most likely not see by terrorists, however, it be a common claim urinate by aggressive nations under these circumstances.	1.0	6.0	1.0	45.0	79000.0	[BOS] This is unfortunately the consequence of conflicts within this part of the world. [BOE] [sadness] [EOE] [EOS] {sep_tok} [BOS]  Certain countries are not interested in the peace process and will deliberatley sabotage any effort. [BOE] [neutral] [EOE] [EOS] {sep_tok} [BOS]  The convey was most likely not escorted by terrorists, however, it is a common claim made by aggressive nations under these circumstances. [BOE] [neutral] [EOE] [EOS]	1.167	2.5	neutral
R_2fea3z0hayINIjT_5	R_2fea3z0hayINIjT	348	"this is a typical ""sour grapes"" approach to anything view the trump presidency. liberals feel that his mere existence will somehow ruin mankind. this approach to constantly fault all of the country's problems on him only further harms to future of the country. behave like the previous president be some ideal be nothing more than revisionist history way of thinking."	1.0	6.0	1.0	45.0	79000.0	"[BOS] This is a typical ""sour grapes"" approach to anything regarding the Trump presidency. [BOE] [neutral] [EOE] [EOS] {sep_tok} [BOS]  Liberals feel that his mere existence will somehow ruin mankind. [BOE] [neutral] [EOE] [EOS] {sep_tok} [BOS]  This approach to constantly blaming all of the country's problems on him only further harms to future of the country. [BOE] [neutral] [EOE] [EOS] {sep_tok} [BOS]  Acting like the previous president was some ideal is nothing more than revisionist history way of thinking. [BOE] [neutral] [EOE] [EOS]"	1.0	2.375	neutral
R_1ml1pyosfEpZIOZ_1	R_1ml1pyosfEpZIOZ	10	register the news prompt me of the sacrifices urinate by men and women of the police departments, the cop bequeath his family that day for work like any other day and he be gun down for coiffe his job, it build me shine on the gun laws of this country. serve we really want to build amendments to curb this streak of violent crimes?	1.0	6.0	1.0	29.0	40000.0	[BOS] Reading the news reminds me of the sacrifices made by men and women of the police departments, the cop left his family that day for work like any other day and he was gunned down for doing his job, it makes me reflect on the gun laws of this country. [BOE] [sadness] [EOE] [EOS] {sep_tok} [BOS] Do we really need to make amendments to curtail this streak of violent crimes? [BOE] [surprise] [EOE] [EOS]	3.167	4.125	sadness
R_1ml1pyosfEpZIOZ_2	R_1ml1pyosfEpZIOZ	94	these mindless killings for misguided beliefs be really start out of hands, someone's husband, father, mother, wife , son, daughter murder violently in the streets build you mislay faith in humanity. are we really beyond redemption? personally i feel isis especially be rise more fearless by the day. the world want to coiffe something	1.0	6.0	1.0	29.0	40000.0	[BOS] These mindless killings for misguided beliefs is really getting out of hands, someone's husband, father, mother, wife , son, daughter murdered violently in the streets makes you lose faith in humanity. [BOE] [sadness] [EOE] [EOS] {sep_tok} [BOS] Are we really beyond redemption? [BOE] [surprise] [EOE] [EOS] {sep_tok} [BOS] Personally I feel ISIS especially is growing more fearless by the day. [BOE] [joy] [EOE] [EOS] {sep_tok} [BOS] The world needs to do something [BOE] [neutral] [EOE] [EOS]	3.833	4.375	anger
R_1ml1pyosfEpZIOZ_3	R_1ml1pyosfEpZIOZ	240	a whooping 2600 pregnant women try positive to this virus in the usa and neighboring states be alarming, i bet everyone register this especially pregnant women would be pall of apply birth to children with microcephaly as if they don't make enough to worry about before. i recollect no amount is too much to undertake this	1.0	6.0	1.0	29.0	40000.0	[BOS] A whooping 2600 pregnant women testing positive to this virus in the USA and neighboring states is alarming, I bet everyone reading this especially pregnant women would be scared of giving birth  to children with microcephaly  as if they don't have enough to worry about before. [BOE] [fear] [EOE] [EOS] {sep_tok} [BOS] I think no amount is too much to tackle this [BOE] [neutral] [EOE] [EOS]	3.167	4.0	fear
R_1ml1pyosfEpZIOZ_4	R_1ml1pyosfEpZIOZ	278	i cogitate people would make a field day over this in blogs and forums, especially the conspiracy theorist who cogitate some cabal exist somewhere operate events and outcomes, the good news be the pilot survive and be regain safely and maybe russia should be more focused on ensure safety of its military .	1.0	6.0	1.0	29.0	40000.0	[BOS] I think people would have a field day over this in blogs and forums, especially the conspiracy theorist who thinks some cabal is somewhere controlling events and outcomes,  the good news is the pilot survived and was recovered safely and maybe Russia should be more focused on ensuring safety of its military . [BOE] [neutral] [EOE] [EOS]	4.333	5.5	anger
R_1ml1pyosfEpZIOZ_5	R_1ml1pyosfEpZIOZ	337	its heart wrenching to register stories and insure pictures of kids thrust into labor. i personally feel that exist the height of cruelty. turkey be particularly notorious for child trafficking and labor, its alarm the government be not doing anything about this problem. children should be couch in school not some factory!	1.0	6.0	1.0	29.0	40000.0	[BOS] Its heart wrenching to read stories and see pictures of kids forced into labor. [BOE] [sadness] [EOE] [EOS] {sep_tok} [BOS] I personally feel that is the height of cruelty. [BOE] [anger] [EOE] [EOS] {sep_tok} [BOS] Turkey is  particularly notorious for child trafficking and labor, its alarming the government is not doing anything about this problem. [BOE] [fear] [EOE] [EOS] {sep_tok} [BOS] Children should be put in school not some factory! [BOE] [neutral] [EOE] [EOS]	4.0	3.75	sadness
R_1C0Z9McLLQtjIo9_1	R_1C0Z9McLLQtjIo9	12	gosh there make be a bus crash, pretty sad. apparently a lot of people be hurt. i feel so bad for their friends and family members, like they aren't even bed if they are okay or what be fit on. really sad situation. i judge more information will be forthcoming because riht now they didn't make all the details yet.	2.0	7.0	1.0	38.0	42000.0	[BOS] Gosh there has been a bus crash, pretty sad. [BOE] [sadness] [EOE] [EOS] {sep_tok} [BOS]  Apparently a lot of people were hurt. [BOE] [sadness] [EOE] [EOS] {sep_tok} [BOS]  I feel so bad for their friends and family members, like they aren't even knowing if they are okay or what is going on. [BOE] [sadness] [EOE] [EOS] {sep_tok} [BOS]  Really sad situation. [BOE] [sadness] [EOE] [EOS] {sep_tok} [BOS]  I guess more information will be forthcoming because riht now they didn't have all the details yet. [BOE] [neutral] [EOE] [EOS]	2.167	2.0	sadness
R_1C0Z9McLLQtjIo9_2	R_1C0Z9McLLQtjIo9	87	omg coiffe you substantiate that bananas could suit extinct? this be so devastating to me because they be one of the only fruits i even like, plus my kids bed them. we ask to coiffe everything we can to keep this from happening~! bananas absolutely must be saved. i recollect this would be a serious issue if this be to actuallyh appen.	2.0	7.0	1.0	38.0	42000.0	[BOS] OMG did you realize that bananas could become extinct? [BOE] [surprise] [EOE] [EOS] {sep_tok} [BOS]  This is so devastating to me because they are one of the only fruits I even like, plus my kids love them. [BOE] [joy] [EOE] [EOS] {sep_tok} [BOS]  We need to do everything we can to prevent this from happening~! [BOE] [neutral] [EOE] [EOS] {sep_tok} [BOS]  Bananas absolutely must be saved. [BOE] [neutral] [EOE] [EOS] {sep_tok} [BOS]  I think this would be a serious issue if this were to actuallyh appen. [BOE] [neutral] [EOE] [EOS]	1.0	1.625	sadness
R_1C0Z9McLLQtjIo9_3	R_1C0Z9McLLQtjIo9	252	so apparently poland be exhume bodies from a plane crash almost ten years ago that they cogitate might make imply some foul play. i imply i guess you gotta start to the truth but i rule it weird when people start grasp up bodies and not to mention it's also a little disrespectful to the dead who make no say in the matter.	2.0	7.0	1.0	38.0	42000.0	[BOS] So apparently Poland is exhuming bodies from a plane crash almost ten years ago that they think might have involved some foul play. [BOE] [neutral] [EOE] [EOS] {sep_tok} [BOS]  I mean I guess you gotta get to the truth but I Find it weird when people start digging up bodies and not to mention it's also a little disrespectful to the dead who have no say in the matter. [BOE] [anger] [EOE] [EOS]	1.0	1.0	anger
R_1C0Z9McLLQtjIo9_4	R_1C0Z9McLLQtjIo9	320	another attack on a mall - while no one be actually hurt, this be just an ongoing trend that interest me so much. it's gottten to where i experience like nowhere we operate be safe anymore. i don't like operate to crowded places anymore or anywhere that there be a lot of people. it look like it's more likely to happen there plus it's always some crazy immigrant.	2.0	7.0	1.0	38.0	42000.0	[BOS] Another attack on a mall - while no one was actually hurt, this is just an ongoing trend that concerns me so much. [BOE] [fear] [EOE] [EOS] {sep_tok} [BOS]  It's gottten to where I Feel like nowhere we go is safe anymore. [BOE] [neutral] [EOE] [EOS] {sep_tok} [BOS]  I don't like going to crowded places anymore or anywhere that there are a lot of people. [BOE] [anger] [EOE] [EOS] {sep_tok} [BOS]  It seems like it's more likely to happen there plus it's always some crazy immigrant. [BOE] [neutral] [EOE] [EOS]	1.833	3.0	fear
R_1C0Z9McLLQtjIo9_5	R_1C0Z9McLLQtjIo9	356	i can't tolerate protesters! i'm so sick of people behave like this be an appropriate way to voice their opinions. behave like animals ruin things, it just sicken me really. what happen to people behave mature and responsible in life? jesus christ, fit out loot things and destroying. what be wrong with people.	2.0	7.0	1.0	38.0	42000.0	[BOS] I can't stand protesters! [BOE] [anger] [EOE] [EOS] {sep_tok} [BOS]  I'm so sick of people acting like this is an appropriate way to voice their opinions. [BOE] [anger] [EOE] [EOS] {sep_tok} [BOS]  Acting like animals destroying things, it just sickens me really. [BOE] [disgust] [EOE] [EOS] {sep_tok} [BOS]  What happened to people acting mature and responsible in life? [BOE] [surprise] [EOE] [EOS] {sep_tok} [BOS]  Jesus Christ, going out looting things and destroying. [BOE] [neutral] [EOE] [EOS] {sep_tok} [BOS]  What is wrong with people. [BOE] [surprise] [EOE] [EOS]	1.0	1.5	anger
R_1N7VCOKiQFNiHeO_1	R_1N7VCOKiQFNiHeO	39	humans cogitate they operate the world and everything in it. this wolf broke away from its pack searching for a mate and destine no harm, but yet, humans, empower snipers to be exact, quickly couch an end to the life of a living be -- for what? it's a shame to view that humans coiffe not prize the lives of anything else on this planet.	1.0	5.0	1.0	31.0	80000.0	[BOS] Humans think they control the world and everything in it. [BOE] [neutral] [EOE] [EOS] {sep_tok} [BOS] This wolf broke away from its pack searching for a mate and intended no harm, but yet, humans, empowered snipers to be exact, quickly put an end to the life of a living being -- for what? [BOE] [neutral] [EOE] [EOS] {sep_tok} [BOS] It's a shame to see that humans do not respect the lives of anything else on this planet. [BOE] [sadness] [EOE] [EOS]	6.332999999999999	5.125	disgust
R_1N7VCOKiQFNiHeO_2	R_1N7VCOKiQFNiHeO	167	i'm glad these orangutans be rescued, despite the circumstance that direct them there. they be sentient beings and should be cover as we humans cover each other - with care. hopefully dina will exist cover and able to live a full life along with the others she be rescue with. we as humans want to register more compassion to all living things in this world.	1.0	5.0	1.0	31.0	80000.0	[BOS] I'm glad these orangutans were rescued, despite the circumstance that led them there. [BOE] [joy] [EOE] [EOS] {sep_tok} [BOS] They are sentient beings and should be treated as we humans treat each other - with care. [BOE] [neutral] [EOE] [EOS] {sep_tok} [BOS] Hopefully Dina will be treated and able to live a full life along with the others she was rescued with. [BOE] [joy] [EOE] [EOS] {sep_tok} [BOS] We as humans need to show more compassion to all living things in this world. [BOE] [neutral] [EOE] [EOS]	6.0	3.5	joy
R_1N7VCOKiQFNiHeO_3	R_1N7VCOKiQFNiHeO	172	its a shame to insure the value these terrorists set on other human lives. torturing and do members of police force or members of the community for what? because their beliefs don't align? to pronounce these people, after be brutally murder coiffe not deserve a proper burial (at the very least) be just absurd.	1.0	5.0	1.0	31.0	80000.0	[BOS] Its a shame to see the value these terrorists put on other human lives. [BOE] [sadness] [EOE] [EOS] {sep_tok} [BOS] Torturing and executing members of police force or members of the community for what? [BOE] [neutral] [EOE] [EOS] {sep_tok} [BOS] Because their beliefs don't align? [BOE] [neutral] [EOE] [EOS] {sep_tok} [BOS] To say these people, after being brutally murdered do not deserve a proper burial (at the very least) is just absurd. [BOE] [anger] [EOE] [EOS]	4.333	5.75	sadness
R_1N7VCOKiQFNiHeO_4	R_1N7VCOKiQFNiHeO	273	"its amaze what our country coiffe sometimes. we steal land from the natives over hundreds of years and their reservations start smaller and smaller as we need to industrialize every bit of america. its silly to recollect that people that once survive on these lands make to survive on ""reservations"" to start with. what apply our government the right to completely master every bit of land and person that subsist on it (before or after they were here?)"	1.0	5.0	1.0	31.0	80000.0	"[BOS] Its amazing what our country does sometimes. [BOE] [joy] [EOE] [EOS] {sep_tok} [BOS] We steal land from the natives over hundreds of years and their reservations get smaller and smaller as we want to industrialize every bit of America. [BOE] [neutral] [EOE] [EOS] {sep_tok} [BOS] Its silly to think that people that once lived on these lands have to live on ""reservations"" to begin with. [BOE] [anger] [EOE] [EOS] {sep_tok} [BOS] What gives our government the right to completely control every bit of land and person that exists on it (before or after they were here?) [BOE] [surprise] [EOE] [EOS]"	4.833	5.0	joy
R_1N7VCOKiQFNiHeO_5	R_1N7VCOKiQFNiHeO	396	crazy to believe that these things be happening - naturally. be it because of global warming? exist there be parties at play here? i don't need to vocalize like a conspiracy theorist, but what exist the cause of all of these wild fires? what else can we coiffe to keep them? we need to protect nature and preserve whats bequeath - everyone should coiffe their part.	1.0	5.0	1.0	31.0	80000.0	[BOS] Crazy to believe that these things are happening - naturally. [BOE] [surprise] [EOE] [EOS] {sep_tok} [BOS] Is it because of global warming? [BOE] [surprise] [EOE] [EOS] {sep_tok} [BOS] Are there are parties at play here? [BOE] [surprise] [EOE] [EOS] {sep_tok} [BOS] I don't want to sound like a conspiracy theorist, but what is the cause of all of these wild fires? [BOE] [surprise] [EOE] [EOS] {sep_tok} [BOS] What else can we do to prevent them? [BOE] [surprise] [EOE] [EOS] {sep_tok} [BOS] We need to protect nature and preserve whats left - everyone should do their part. [BOE] [neutral] [EOE] [EOS]	4.0	4.0	surprise
R_1ozjteCWKLw5htX_1	R_1ozjteCWKLw5htX	45	this article make build my heart so heavy. i feature to pause a couple times while reading, just to forgather my thoughts so that i could continue. i feel for the innocent people who should not make be imply in this at all. i bid that we could serve something to avail these people descend to an agreement so this terrible conflict can end. i can't even start to imagine what it must feel like to survive in a place where you make to make such strong fear to even leave your home. i can't imagine subsist amongst such stress and turmoil. my heart be so heavy and i wish there be something i could coiffe to help.	2.0	2.0	1.0	23.0	34000.0	[BOS] This article has made my heart so heavy. [BOE] [sadness] [EOE] [EOS] {sep_tok} [BOS] I had to pause a couple times while reading, just to gather my thoughts so that I could continue. [BOE] [neutral] [EOE] [EOS] {sep_tok} [BOS] I feel for the innocent people who should not have been involved in this at all. [BOE] [sadness] [EOE] [EOS] {sep_tok} [BOS] I wish that we could do something to help these people come to an agreement so this terrible conflict can end. [BOE] [joy] [EOE] [EOS] {sep_tok} [BOS] I can't even begin to imagine what it must feel like to live in a place where you have to have such strong fear to even leave your home. [BOE] [fear] [EOE] [EOS] {sep_tok} [BOS] I can't imagine living amongst such stress and turmoil. [BOE] [surprise] [EOE] [EOS] {sep_tok} [BOS] My heart is so heavy and I wish there was something I could do to help. [BOE] [joy] [EOE] [EOS]	7.0	7.0	sadness
R_1ozjteCWKLw5htX_2	R_1ozjteCWKLw5htX	138	i be swagger in school, which direct to self harm, and eventually a suicide attempt. this article prompt me so much of myself, and i need to coiffe something to couch a stop this bullying. as i sit here with tears well my eyes, now a mother, i can't imagine be in the shoes of these parents who misplace their children all because other kids just can't be nice. i am so sad for these kids who insure no other way out of this mess than to just terminate their lives. their pain be mat deeply in my soul, and my wish be that somehow, someday, no one else will feel that kind of pain.	2.0	2.0	1.0	23.0	34000.0	[BOS] I was bullied in school, which led to self harm, and eventually a suicide attempt. [BOE] [sadness] [EOE] [EOS] {sep_tok} [BOS] This article reminded me so much of myself, and I want to do something to put a stop this bullying. [BOE] [joy] [EOE] [EOS] {sep_tok} [BOS] As I sit here with tears welling my eyes, now a mother, I can't imagine being in the shoes of these parents who lost their children all because other kids just can't be nice. [BOE] [sadness] [EOE] [EOS] {sep_tok} [BOS] I am so sad for these kids who saw no other way out of this mess than to just end their lives. [BOE] [sadness] [EOE] [EOS] {sep_tok} [BOS] Their pain is felt deeply in my soul, and my wish is that somehow, someday, no one else will feel that kind of pain. [BOE] [joy] [EOE] [EOS]	7.0	7.0	sadness
R_1ozjteCWKLw5htX_3	R_1ozjteCWKLw5htX	248	i bed that not everyone fit with trump suit president, and i will admit that i'm not certain of the path this country be operate to take, but there be many many many people that coiffe not approve of obama suit president, yet we all survive that, as we will this. as a woman, and one who be espouse to a biracial man and make a biracial son, i will say, i coiffe not fear my exsitance or my families. even if trump be not the most respectful, he is not out to start women, people of color, etc. he be try to coiffe what be best for this country, and he be vote in, so we need to just start on with our lives and hope for the best.	2.0	2.0	1.0	23.0	34000.0	[BOS] I know that not everyone agrees with Trump becoming president, and I will admit that I'm not certain of the path this country is going to take, but there were many many many people that did not approve of Obama becoming president, yet we all survived that, as we will this. [BOE] [neutral] [EOE] [EOS] {sep_tok} [BOS] As a woman, and one who is married to a biracial man and has a biracial son, I will say, I do not fear my exsitance or my families. [BOE] [neutral] [EOE] [EOS] {sep_tok} [BOS] Even if trump is not the most respectful, he is not out to get women, people of color, etc. [BOE] [neutral] [EOE] [EOS] {sep_tok} [BOS] He is trying to do what is best for this country, and he was voted in, so we need to just get on with our lives and hope for the best. [BOE] [joy] [EOE] [EOS]	1.5	1.125	neutral
R_1ozjteCWKLw5htX_4	R_1ozjteCWKLw5htX	323	i coiffe cogitate that this male birth control for men should be a thing. men should be able to determine if those risks be worth the protection. men should make the ability to pack birth control in their own hands, as they never know if a woman exist rest about pack her's or if they make been pack it properly. an added protection could never wound for both parties. i, however, coiffe not feel very sympathetic. i cogitate women be always search for things to plain about, and this be just another thing. women, get over it. if your side effects from your birth control be too strong, then just don't feature sex.	2.0	2.0	1.0	23.0	34000.0	[BOS] I do think that this male birth control for men should be a thing. [BOE] [neutral] [EOE] [EOS] {sep_tok} [BOS] Men should be able to decide if those risks are worth the protection. [BOE] [neutral] [EOE] [EOS] {sep_tok} [BOS] Men should have the ability to take birth control in their own hands, as they never know if a woman is lieing about taking her's or if they have been taking it properly. [BOE] [neutral] [EOE] [EOS] {sep_tok} [BOS] An added protection could never hurt for both parties. [BOE] [neutral] [EOE] [EOS] {sep_tok} [BOS] I, however, do not feel very sympathetic. [BOE] [anger] [EOE] [EOS] {sep_tok} [BOS] I think women are always looking for things to complain about, and this is just another thing. [BOE] [neutral] [EOE] [EOS] {sep_tok} [BOS] Women, get over it. [BOE] [joy] [EOE] [EOS] {sep_tok} [BOS] If your side effects from your birth control are too strong, then just don't have sex. [BOE] [neutral] [EOE] [EOS]	2.0	1.0	anger
R_1ozjteCWKLw5htX_5	R_1ozjteCWKLw5htX	359	i cogitate that be gay is not a choice, and that we should consent these individuals no matter what. their gayness be not wound or sham you in any way, so start over it. i cogitate be natural for someone to be attract to either sex, and we want to be more accepting of it. i bid i could bosom every gay person who make ever mat like they be worth less than they are, because they be worth just as much as everyone else.	2.0	2.0	1.0	23.0	34000.0	[BOS] I think that being gay is not a choice, and that we should accept these individuals no matter what. [BOE] [joy] [EOE] [EOS] {sep_tok} [BOS] Their gayness is not hurting or affecting you in any way, so get over it. [BOE] [joy] [EOE] [EOS] {sep_tok} [BOS] I think is natural for someone to be attracted to either sex, and we need to be more accepting of it. [BOE] [joy] [EOE] [EOS] {sep_tok} [BOS] I wish I could hug every gay person who has ever felt like they are worth less than they are, because they are worth just as much as everyone else. [BOE] [joy] [EOE] [EOS]	7.0	7.0	joy
